filtered_lyrics,primary_genre
AyyNever worry bout a single hatin motherfuckerLookin like my next supperAll these moves that I m makin got people talkin Like How many papers is this man signin I m back wit the backpack rapMan I m thinkin that this shit finna make them scatGot a bag full of cash if we talkin bout thatRun run it like Forrest Gump can you feel that AyyI m a renaissance manIf you wanna get a feat you not gon get response manI be hotter than some shit your mom cook in a sauce panDon t be jealous don t be rude go back to rollin up gramsPeople think I m sick as shit but I m just eatin on hamWanna beat me in my game then bitch I m settin up campWhen the females hear my name I know they pussy all dampMr Veterinarian I make that kitty go ham Damn Ballin only seventeen my skin is greenWatchin numbers goin up that s just the everyday routineAll my old friends hit me up they wish they had a time machineFeelin like I m Cube I always hit em with no vaseline Post Chorus Always sayin no when you ask em if they got beef with meDMs blowin up I always say No bitch this dick ain t free Watchin on your every move I got that shit on DVDFlexin all the time but I just know that you a bourgeoisie You got cash buy some chainsI buy houses ain t that strange You ain t shit I get lit all you do is counterfeitLittle chick but she thick and she always on my drinkShit I m thirsty give it back and she blondy just like Zac Who the fuck is Zac High School Musical Bitch hold my stacks I m minutes late to FranceGotta get this cash never give no chanceBetter bounce that ass paid her an advanceGot me through this day sippin on BombayI don t trust you gotta take this surveyMan I don t look back never cut no slackBetter get way back fore yo ass get smacked uhMemphis flow but I m from Jakarta hoNever understood my hustle but I guess the more you knowCheckin on your Instagram I see that shit is going slowAlways hating on the progress man yo ass has gotta go,Rap
Yeah happy birthday to meI m nowAnd women can legally have sex with meShout out Based God I be ridin right down Melrose with a thicky named RoseSittin on my lap but she just tryna be my friend thoughBumpin on that XO and I m bout to call my ex hoMommy daddy home I barely see them like a rainbow You can t get rid of me I ain t goin nowhereAnd I m always multiplyin like I always fornicateCake cake up on this belt the day I landed in the StatesDoin one take all day and I m just spittin out the mace Mace She like sippin out that mason jarShe a hippie she gon suck for some granola barsLittle freaky got me curious like I m on MarsSayin I forgot my roots goddamn you went too far Ayy damn you went too farGot these people all around me man that treat me like a starDressed like I don t give a damn but I be ballin like LaVarGotta wait about three years until I could go to the bar Damn make all my own shit I get all the profitsIf you actin lazy then do not expect your props bitchMovin with the tactics got Gildan on my fabricsGo ham on the mic just like I m sitting in the cockpit ayyUsed to hate the camera now your boy s a naturalNow your boy is on the road two months and I ma get the loadTry to put me in a box I m gon always break the lockCall me D Wayne cause she licking on my Johnson like The RockOh my God man his voice so deep I thought he was plusBrian be so clean wanna let him spank on my bumHe just turned but for him I d catch a case damn Hold up ,Rap
Hello Brian this is your grandmotherUm I don t know if you remember me butDo you have time to maybeMeet up and touch base aboutYou know talk about life maybeAnd catch up you know No no I don t know don t be askin me no moreI just close my door put the do not disturb onDon t you get too close you know I m an animalDon t want to stay too long I just get this shit to goSlo mo when I move so I do not lose controlLomo camera every time I fuck your hoeAirbnb s now start to feel like second homeShe on my dick now this is just a second song Actin like a hooligan I swear I think I m fuckin losin friendsSomebody called me up and told me I ma meet the presidentI said okay then I proceed to leave my friendsAnd every citizen and everybody where I m livin aye ayeYes lawd bought some Bitcoin was bout to buy some moreShe a vegan eatin seared loins can t commit to loveI ain t Google I don t give no answers got the firewallThey keep askin me about some things that they already know I say No no I don t know don t be askin me no moreI just close my door put the the do not disturb onDon t you get too close you know I m an animalDon t want to stay too long I just get this shit to goSlo mo when I move so I do not lose controlLomo camera every time I fuck your hoeAirbnb s now start to feel like second homeShe on my dick now this is just a second song Back in my hometown got me feeling extra strongWhere I ma go now nobody gon really knowCame with a new sound just by sitting in my roomSmell hella good now I been puttin on perfumeTakin pictures with the girls I keep my hits up in my vaultMy rhythm still left in the winter think you gotta wear an extra coatI m Tarantino with the shit directin music videosMan I can sense your cluelessness don t even interview me hoeHoe tell your man to go cause he been stickin like some throat coatI don t like your energy I skate away like FrozoneYou been hearin things about me and you want to know knowIf it s true or false and then I hit you with the ,Rap
Ayy See me run see me runRunnin til my lungs might giveRunnin for the front I feel like Usain in this bitch Ayy Passin all these runners number one is in my listBlinders on me I can t even seeSee me in my tour bus by myselfCall me selfish cause I got me and nobody elseGive myself an envelope just like it s per diem Ayy Twenty mirrors in my crib I m hangin with my friends Feelin like I traveled through some time oh manSkippin through some years but it feel right oh yeahGettin ready for some blessings comin our wayForrest Forrest runnin for some days I ll do the shit til the credits rollAlready got through the greatest goalsMet with a girl when I went back home Ayy She put me in a group chat with that pussyTalk to it send emojis to the pussyThen beat it up til it wanna go sue me Ayy My brother called me and told me to man upTold me to be lactose tolerantMan stop avoidin that cheddar Ayy In love with the Solo cupsI m on the road and I m lovin my bunkStill missin home but I m havin my fun uhI would never quit I m too legitIndonesian MC Hammer in this bitchBeat your ass if you correct my grammar in this bitchI done way too much for you to say my parents rich Nah But I m tryna make it happenMakin green like GeicoAll because I m nice hoThey know what I like thoughPussy on my riderGroupies is some psychosMy bedroom is a psych wardTell that girl to smile moreI take it on my Leica,Pop
I m givin my number to any bitch lookin like RondaI m Gunner Stahl I m takin many picsI m thinkin bout havin many kidsEven Osama gon be like Goddamn that s a lot of kids Lot of kids Hit em with a good amount of the hitsI m thinkin will I put em out of the biz Shout to uicideBoy kill em all rest in pissSip on LaCroix on the bus that I missedTalkin bout somethin that I never didI talk to myself and all my seven chicksThey love to go down just like your relevanceI m a rapper but my name isn t ChanceCome to my show people think I m intenseDon t look amused somethin wrong with your lensOne day the money s gon be for the BenzFlow be so dirty it needed a cleanseI m in my zone I went through this shit aloneDidn t have no friends talk to myself we always get alongI m still learnin I m still fuckin up correct me if I m wrongTalkin business more than usual that means I m out with Sean Never yellow in my urinal I m always drinkin on that PellegrinoI been rockin my own merch I m makin way more green than CeeLoI saw people from my school they all turned out to be some weirdosI don t need no education Internet s my favorite teacher Interlude Ayy ayy told em told em Told that bitch that I don t really give a fuck bout youTold that man that he gotta quit it ain t coolMakin up for the confrontation that I ain t doAs a teen all the fight I ve been in was virtualNow I m gettin old and my dick is gettin olderKeep seven bitches on my phone like a folderWhen they were man I was a toddlerDamn homeschool felt like yesterdayI worked at my mom s cafeMet a girl like every dayIt s my only social placeThey thought I was from LANo I m not but now I m hereTryna fill my parents plateThey call me up like every dayPeople say I m good they say I get what I shouldTell me not to worry everything will go real smoothPeople think I m Dory I m forgettin bout my hoodMan should I be sorry for just doin somethin new Man these dudes gotta be more quiet than they thinkThey be hella sure but I always say amenDo the shit for the people that look like meSo the girls can see them and they think of meAnd not that kid that throw that fit Cause he didn t get straight A s all week,Rap
Ummm ayy Now I see that everybody start to fuck with me Cause they feelin like I m finna go down as a OGFlame lowkey on the top of their dictionaries talkin down on meAnd I always say Guess we ll see Guarantee that you re always finna think I m on speedSound a little trippy think I m on LSD when I started doing itHome school kid never knew he was a prodigy ayeGet back on the track with the crack stackPilin in my wallet gettin fat like a shake shackPictures on my Snapchat that s all I got about last nightAll I know is she was goddamn tight aye Went to America shit is feelin biblicalAll my life I only saw it on the digitalSaid I don t give a fuck about a mothafuckin po On the visa so I can t be smokin indica Flyin hours never felt so rightThey say I get better as the days go byI m just tryna be the goat used to see them walk byGettin ready for this life all I see is red and whiteFlyin hours never felt so rightThey say I get better as the days go byI m just tryna be the goat used to see them walk byGettin ready for this life all I see is red and white Landed in Chicago met the customsMean muggin mothafuckers let me tell ya somethingAnd I almost got deported back to the home town Cause I didn t know what road my hotel s onThen I met my manager Sean chillin in the passengerAnd I m feelin tripped out seein him for the first timeWorked oas for a year that s a long run Now I m finally hereWhat now What to do next I don t careEvery single day feel like I m on a missionWorkin with Pharrell on my first damn sessionNever had to write in a room with nobodyFeelin under pressure man this dude made Happy Wrote a couple bars while chuggin on a Red BullThen all of a sudden all my worries turn into vapors ayy,Rap
I done wore a lot of hatsTell my team take all my people to the back I don t need to flex or tell the people where I m atWho I m with or who I m seein later where I wentAll their validation ain t gon matter in a sec Throw back to the fake RolexPut it on and went into the club like Where the hoes at Member sittin down on my computer bumpin KodakThinkin I should probably go delete all of my old tracksSilly me for thinkin I should probably done more of thatI like all my women short and sweet like all my old raps uhGotta wait til I m done ayy Don t need no more trash I got too many where I m from ayy I done put in work and now I m havin all the funI just did a tour I m ready for another oneI can turn your girl to mine in just a secondDon t get fooled by how I smile cause I can get to actin recklessI been livin so good it s been a while that I ve been jealousKillin shit is what I say when they ask bout my occupationGot my U S Visa on the day before I flew in ayy I don t got too many friends I just hang with the sRed and white born and raised took a flight to LAHang with my day to day kiss a chick in the faceThen I put it on her face we still goin through this phaseWe been fightin everyday shit is sad like animeNever wanted it to be a mess but you gotta get up out my wayDriving lesson shoulda told you stay up in your laneWhen I m doin business better stay the fuck away Fuck away Made me blow up like a microwaveI be makin sure that I be fuckin up your dayI don t mind the fansShowin love to everybody be the most important thingI got Andrew with me and he down to take a stabWait for me to walk it is the word he always sayAll these protocols I m slowly turnin to a diva manI ma beat the runner s ass if he ain t got my Chick fil A Chick fil A Never like to brag but I do it in my rapsWhat I m tryna tell you is I done wore a lot of hatsTell my team take all my people to the back Ayy I don t need to flex or tell the people where I m atWho I m with or who I m seein later where I wentAll their validation ain t gon matter in a sec,Rap
I need to get something off my chest Cause lately I have been upsetYou make me wanna dress in redAnd sing with my head out the windowI know it s better to be coldBetter to wonder than to knowAnd so I m gonna play the roleThere might be some tears on my pillow Don t know what I wantBut I know I really really wanna cling to youYeah my heart is innocentBut my body really really wanna sin with you We could be lovers in the nightWe could be strangers in the lightIs it going too fast for you Going too fast for you Lovers in th nightWe could be strangers in th lightIf it s going too fast for you Drop We don t need to put no label on it do we now Oh my loveWe don t need to put no label on it do we now Oh my love Baby I know your love is bad Cause that is why I wanna have itYou make me walk on broken glassAnd sing with my head out the windowWatching every tiny move you makeWhile I pretend to look awayYou know I ll take what I can getThere might be some tears on my pillow Don t know what I wantBut I know I really really wanna cling to youYeah my heart is innocentBut my body really really wanna sin with you,Pop
 Running through the night Wait for the night Where are we going Oh Where are we going Oh star ,Pop
Oh where I go Losing controlStill I could seeHow far I ll go You ll never knowWhere I will be Constantly chasing upConfess why you miss itCertain you ll realizeYet sure you will miss it On this wayWhen all is doneIn timeWe ll face the endEnoughI ve waited all my lifeTo take this price Where I go No one will face the truth behindTell me your true desireAnd what you believed in On this wayWhen all is doneIn timeW ll face the endEnoughI v waited all my lifeTo take this price Constantly chasing upConfess why you miss itCertain you ll realizeYet sure you will miss it,R&B
Breathe it in my babyYou triggered my ladyYou know I always repayLet s enjoy it slowlyI should wantYou should want People say my love is unsafeIt s like a swampI don t know what the hell to doPeople like to talk nonsenseAnd only you catch my attention My mood is covering your hollow blade Hollow blade It s like the fogWhat are you doing with that shit After the partyDon t ask me about my exToday he ll be my dinner Hook I love it when you cryBe mine mineI love how you move in painBe mine mineI love the way you despairBe mine mineAre you gonna leave me Are you gonna leave Me Post Chorus Bite me like that againYou hid the bullet in the sandDo it like meNow you choose to trigger or stay  I heard you killed me a hundred times in your dreamsThat s funny You can t even touch me anywaysOr do you want to bite my lips and taste my blood Come be dirty with me,R&B
We don t have time Star When you call my nameI remember you used to dry myHair that rainy dayOh my loverWhen you call my name once againAll will be alrightYou touch my mind ,R&B
 Let s drive It s just my value It s just my value do it so far away Don t come day day No blame me Really high I m really high Wanna hide I wanna hide yeah Let s fly high It s just my value It s just my value do it so far away Don t come day day No blame me Really high I m really high Wanna hide I wanna hide yeah Let s fly high,R&B
Dreams are bound to breakWhy didn t I know that Life hastens meAnswering what Answering what Hide me inside myselfI m afraid I ll drownRiver of fearAnswering what Answering what Why is hope evil and sweet I m always fooled your liesVeiled in a smile and hugI can t stop heading to the end Why do you leave I m aloneEverything is repeated again and againAnd I m going downWhy did I believe believe your love I had a dream without even knowingLost in the waves but now I knowIt s just a fairy tale Who s knocking on my door You know I can t stopWhat do you want and answering what I I don t need anymoreTalk to myselfPlease don t ask meAnswering what Answering what Why is hope evil and sweetI m always fooled your liesCan t take my eyes off of youEven though I know everything,Pop
I want let me go What should I do now why Where is my hope Nobody calls me loves me notI just needed someone else Please don t come to me What should I do now why Where is my hope Nobody calls me loves me notI just needed someone else,Pop
 Beautiful Night It s a Beautiful Night It s a Beautiful Night,R&B
 intro Baby take my handI want you to be my husband Cause you re my Iron ManAnd I love you Baby take a chance Cause I want this to be somethingStraight out of a Hollywood movie I see you standing thereIn your Hulk outerwearAnd all I can thinkIs where is the ring Cause I know you wanna askScared the moment will passI can see it in your eyesJust take me by surprise And all my friends they tell me they seeYou planning to get on one kneeBut I want it to be out of the blueSo make sure I have no cluesWhen you ask Baby take my handI want you to be my husband Cause you re my Iron ManAnd I love you Baby take a chance Cause I want this to be somethingStraight out of a Hollywood movie Now we re having dinnerAnd baby you re my winnerI see the way you smileYou re thinking about the aisleYou reach in your pocketEmotion unlockingAnd before you could askI answer too fast,Pop
  Stephanie Poetri Wake me up with a kiss on the checkSaid I was talkin in my sleepAnd I knew oohThere s no where else I d rather be than with you oohGot me thinkin that I m dreamin Pre Chorus Stephanie Poetri Never been in somethin like this beforeLove was scary but it s not anymoreTrue oohNever really did believe now I do ooh ooh Chorus Stephanie Poetri Let s blame the weather you call your friendsSpend my Friday weekend plans to cancel them insteadWe go tog ther like coffee and breadWith our TV shows and br akfast in bedOn Sunday mornin let s stay in the sheetsDoin nothin with you here means everything to meYou re like a theme song that s stuck in my headWith our TV shows and breakfast in bed  gnash I like bein alone with youI like bein home with youDual matches and watch The OfficeI hate thinkin shows with youJim and Pam will never understand the type of Saturday dumb shit we doOrder eggs and bacon wakin and bakin for Mario Kart hit the snooze I ve Pre Chorus Stephanie Poetri gnash Never been in somethin like this beforeLove was scary but it s not anymoreTrue oohThere s nowhere else I d rather be than with you ooh hoo Chorus Stephanie Poetri gnash Let s blame the weather you call your friendsSpend my Friday weekend plans to cancel them insteadWe go together like coffee and breadWith our TV shows and breakfast in bedOn Sunday mornin let s stay in the sheetsDoin nothin with you here means everything to meYou re like a theme song that s stuck in my headWith our TV shows and breakfast in bed,Pop
Ooh yeahOh oh Picking petals off of daisiesThinking bout you on the dailyI just wanna be the one you wantI just wanna be the one you loveGot me thinking you could save meEverybody think I m crazyI just wanna be the one you touchI just wanna be the one you trust Do you love me love me love me love me love me yeah Yeah Do you love me love me love me love me love me not Love me not Do you love me love me love me love me love me yeah Do you love me Do you love me love me love me love me love me not This love ticket is a one wayKnow your heart is my destinationNot now but maybe somedayWe could have a different conversationEven though I know you got somebodyAnd I got somebody tooStill counting down the hoursTill I m out of petals on this flower Do you love me love me love me love me love me yeah Yeah Do you love me love me love me love me love me not Love me not Do you love me love me love me love me love me yeah Do you love me Do you love me love me love me love me love me not Do I ever cross your mind Heaven knows you been on mineYou re driving me crazyOh babyDo I ever cross your mind Heaven knows you live on mineYou re driving me crazyOh baby,Pop
My heart is sinkin Heart in my throatDrownin in your old leather coatAnd now I spend my weekends aloneAnd think of all that I did now that I don t You moved out to westAnd I moved to the city made separate bedsBut I still hold you in my chestWhen things aren t looking prettyWishing you the best But am I kidding myself it s after midnightKicking myself for stayingCould I picture myself believin Picture myself believin Am I holding the words my head wants to hide Thinking the worst foreverCould I picture myself believin Picture myself believin in us My head says one thingBut this feels amazin Forever is somethingBut together we re crazy,Pop
Friday where you at Then I hit you backI ll hit you with that come through cause I know you want toSaturday I m out where the part you out Didn t think you d be hereWho s that girl I see here You re so problematicOverdramatic the way I can t let it goI know that we say we d keep it all on the low No I don t wanna be selfish yeahBut I am when it comes to youI don t wanna be desperate yeahBut I am when I can t have youI don t want to want you as bad as I want youBut I know that you want me tooI don t wanna be selfish yeahBut I am when it comes to you Sunday I m in bed all up in my headWhy you even in there Really thought I didn t careAnd I ve been trying to catch a vibe Cause when we re together feels like we re together,Pop
Twinkle lights on the ceilingBaby you make me feel things that I ve never felt beforeTen fingers tangledSaid I look like an angel as we re lying on the floorClose your eyes for a momentDo you feel like you re floating On a little private shoreOne million reasons why you won t find me leaving Cause I ve never wanted more Honey honey honey honey honeymoonWe be doing things that honey honey honey honeys doBuild a field of flowers just to waste the hoursRun away with youOn a honeymoon on a honey honeymoon Post Chorus Picnic made for twoAnd we could and we couldBuild a field of flowers just to waste the hoursRun away with youOn a honeymoon on a honey honeymoon Sweet like Hi Chew and I Got a sweet tooth so I Blame it on you mmI know you re good for me yuh Don t want it sugar free no I love you endlesslyAnd I don t wanna leave thisLife that we re makin And the future we re shapingThere s so much that s left in storeOne million reasons why you won t find me leavingCause I ve never wanted more,Pop
One two P MIt s P M I m still asleepI wanna wake up but I m too weakTo face the day I m too afraid Breakfast ain t breakfast no moreFeel like I m on vacay when I m at the storeMy socks feel neglected haven t touched the doorI can t recall what it s like beforeIt s always just eighteen degreesThe AC might break and I drink too much teaWish I had a boyfriend I guess it s just meDaydreaming constantly Yeah I wanna say that I m okayBut I don t know if that s the way to beWhen in reality It s P M I m still asleepI wanna wake up but I m too weakTo face the day I m too afraidDon t wanna feel sad and just repeatTh times I ve had feels incomplet Wanna escape but I m too afraid Post Chorus One two P MOne two P M I join too many calls at nightMy screen is too bright and we all are too quietBut still I keep waitin for that Zoom inviteOnly feel alive when I m online Yeah I wanna say that I m okayBut I don t know if that s the way to be To be to be to be When in reality,Pop
Slept through my alarm looked at my phone I m kinda lateNow my schedule s all messed up I didn t even start my dayBut I had a dream that I flew up to the sky and it was pretty greatI guess it s worth it pretty worth itCaught my sleeve goin out the door messed up my favorite sweaterMy reflection caught my eye now it looks even betterThen I lost my keys and I had a reason to say Hi to my cute new neighbourI guess it s worth it really worth it Cause it brought me straight to youAnd it s like I always knewThat the littlest things I would never doIt would bring me straight to you straight to you straight to you Post Chorus Straight to youStraight to Walked into work and who do I see A familiar stranger starin at meWhat are the chances I d run into you I guess love really comes out the blueNever really thought love would come from an accident but I m not mad at itI guess it s worth it you re so worth it Cause it brought me straight to youAnd it s like I always knewThat the littlest things I would never doIt would bring me straight to you straight to you straight to you Post Chorus Straight to you Yeah yeah Straight to you Oh Straight to you Yeah yeah oh Straight to It brought me straight to you it brought me straight to youIt brought me straight to you it brought me straight to you Straight to you It brought me straight to you it brought me straight to you Oh It brought me straight to you it brought me straight to you To you ,Pop
