filtered_lyrics,primary_genre
 Watch me danceWatch me sing Watch me danceWatch me sing I got mercy I got graceDesperado with the scalesThrow a rose on your bodyMask of Zorro I m so wanted Look scared ,R&B
 Dice and Ice cube Home girls bitches Spin it spin it pussy Chips and chips and chips and Demon under the table Risk it risk it risk it till the last dime Yeah yeah yeahRisk it risk it risk it till the last B b bitches Ice and home girl on you on home girlBitches Ice and home girl on you on home girlBitches Ice and home girl on you on home girlBitches bitchesRisk it till the last dimeGive me that hook that spin that rouletteVodka in my cup Spin it tip it strip it shawtyGive me that hook that spin that roulette Taste the muzzle of a gunTaste the of moneyYou think I m dazzle up my Tie that bitch ain t funny chips checks matches and chicks Yeah yeah yeahRisk it risk it risk it till the last,R&B
 champagne It might be pretty it might be beautifulIt might be grandThis might be right this might be justiceBut I Welcome well doneShameless friends of mine Hang my pretty head in your roomWhere is love Where is my sympathy Is it a farm Is it society Am I a tiger or a gazelle It might be pretty it might be beautifulIt might be grandThis might be right this might be justiceBut I ,R&B
 BAD SAD AND MAD Refrain You blued my bruisePink me with tiesYou red my mindYou red my mindBlack my bones andPurple my eyesYou red my mindYeah you red my mind Ah ah ah Drip drip drip drip on my waistAnd I keep keep keep keep beggingAnd addicted I digged it yeahAddicted I digged it yeahDrip drip drip drip on my waistAnd I keep keep keep keep beggingAnd addicted I digged it yeahAddicted I digged it yeah Pet me pet me Yeah Hm hm,R&B
 ,R&B
 I like that I like that Let s ride Oh oh oh oh oh Oh oh oh oh oh I like that I like that Let s ride Oh oh oh oh oh Oh oh oh oh oh  ,R&B
 Maybe If IWoke up in the morningHearing your voiceMaybe If I was with you The distance between you and meIt never seems to disappear I would try try try Only if youIf you come The distance between you and meIt never seems to disappear ,Pop
 Jotto mm mmJotto mm mm mmJotto Jotto pills and wine Jotto mm mmJotto mm mm mmJotto Jotto ,R&B
 PADO If someone hear me call me You are my wave mayday I m a castaway Soaking me slowly slowlyDrowning me cruelly cruellyKilling me gently gentlyCall him if you see my S O S You are my wave mayday I m a castaway,R&B
 I need you When my instinct hit me badCryin like some pussy cat on the bedAnd when my instinct hit me sadMess around this whole town Cause I m fucking mad huh huh huh When my instinct hit me badCryin like some pussy cat on the bedAnd when my instinct hit me sadMess around this whole town Cause I m fucking mad,R&B
 Feed me feed mePlease adopt mePet me pet mePlease comfort me Feed me feed mePlease adopt mePet me pet mePlease comfort me ,R&B
 I need you got my weapon not gonna let it happen check I got weapon not gonna let it happen bitch got a weapon Better than a tongue I got weaponBetter than a snitch what just happen Got a pretty throat will be takenYou better you betterYou better learn when she get Yeah yeah yeahYou better you betterYeah yeah yeah yeah yeah yeahYou ooh ooh ooh oohYou bett r learn when she l t you ooh ooh ooh ooh now you shackledMy homies now you locked up got my weapon razor now you fucked up better shut up I m that weapon Better than a tongue I got weaponBetter than a snitch what just happen Got a pretty throat will be takenYou better you betterYou better learn when she let you ooh ooh ooh oohYou better learn when she let you ooh ooh ooh ooh,R&B
 Fill me fill you i got some loveFeel me feel you i got some loveFeed me feed you with my loveFill me fill you with my l o v e Fill me fill you i got some loveFeel me feel you i got some loveFeed me feed you with my loveFill me fill you with my l o v e,R&B
Nobody told meI can have the whole chocolateSo I fed it to my buddyNobody told meI get grands for hour and halfSo I sold it for one hunnit Yeah I allow myself to lose it to lose itAllow myself to lose itYeah allow myself to lose it to lose itAllow myself to lose it Cause I sold it for one hunnitSold it for one hunnitI sold it for one hunnitYeah I allow myself to lose it Nobody told meI can taste my own birthday cakeSo I kept it in my closetNobody told meI can throw myself to doomsday lakeSo I let myself go lose it,R&B
 Wet Nightmare Pop champagne all nightPut the chandelier up highBodies on my bedAll my baddies gonna up all night hah hah hah hah hahBang hard to say goodbyeYou were my favorite thing til nowBodies on the deckCold water is up your neckLeast loved will be there say Hi Baby tell me whyYou keep showing up in my dream Oh oh oh oh oh oh ohIn my wet nightmareOh oh oh oh oh oh ohVisit my wet night terror Love got me hauntedGot me trapped inBaby got me stuck inside your heartYour body got me drowningGot me soakingBaby got me stuck inside your heartYou re pretty even dyingEven ghostingPretty even cause you broke my heartLove got you hauntedGot you trapped inBaby got you stuck inside my heart Baby tell me whyYou keep showing up in my dream ,R&B
Open your eyesMind your own businessOwn business and IKeep yourself low But I go high Yeah But I go high I m going highPull me down with your tongueI m a starTry to take me down and wave me goodbye Pull you down with my voiceFalling starsIf you need it I can be sacrificed cause,R&B
 Fly with me With stony eyesWhat are you looking forWith snowy faceWhy are you look so blue Fly with me why don t you fly with meThrough the starsFly with me why don t you fly with meThrough the night Fly with me why don t you fly with meThrough the starsFly with me why don t you fly with meThrough the night  Baby Venus Earth to Mars Jupiter Fly with me why don t you fly with me Fly with me why don t you fly with meThrough the night,R&B
 Timeless Inside of me I ll find you ,Rock
 Give More Care Less Give a little more give a little moreCare a little less care a little lessGive a little more give a little moreCare a little less care a little lessGive a little more give a little moreCare a little less care a little lessGive a little more give a little moreCare a little less care a little less Give a little more give a little more give a less care on my ring ring baby Chicks gonna get youChicks gonna hate youChicks tryna keep youIn her feelings too You nice give er that I knowSo I m gonna take itNot gonna keep itLet things go onLet things just flow Give a little more give a little more Give a little more Care a little less care a little less Care a little less Give a little more give a little more Oh Care a little less care a little less Care a little less Give a little more give a little moreCare a little less care a little lessGive a little more give a little more Give a little more give a little more Care a little less care a little less Care a little less ,R&B
 SPARKLING Come and talk to me baby La la la la Love me Tell me what to do what to doTouch Ah hoo Ouch Ah hoo Tell me what to do what to do Ah yah ooh no away Sparkle Oh baby you re all mine mine I I I Oh baby you re all mine mine I I I Drop it So oh oh oh oh oh you make me sparkle Ah Oh oh oh oh oh oh I ll be your sparkleSparkling flavor No no oh my favorite Take me all the way oh Fallin lovin I ma dive inGosh Ah hoo Crush Ah hoo Tell me what to do what to do Ah yah ooh no oh Sparkle ,Pop
 XXXX Fuck Shit na na na na Yeah yeah yeah You you feelin me feelin sharp and riskyShaped like diamond Yeah Now come beg on my feet like diamond Diamond beauty Yeah Beauty Uh reflecting different parts of me dily Oh yeah Tear me do do do do do do down Do do do down hit me harder Hit me harder Dare me do do do do do do down Down down oh cause I m a fighter yeah oh Tear tear me down tear me down tear me down I won t cover up anymoreShattered pieces shine on the floor yeah oh Dare dare me down dare me down dare me down Guess I should be thanking you forGlittered pieces shine on the floor Ain t gonna waste my timeGracefully facing you haters cryOut of my way don t mindGibber and gabber go get a life Ooh I got the game I m on the reignStuck in my trap now obeyNo reason to vile in the back backHouse of the clown make me crack crack,R&B
 Louder Hey Say No matter what it is I will be listeningWay Ah ah ah Free louder louder all the hater haterIt s time to raise our voice Raise our voice Let s go and make some noise future future Breakdown Hey Hey Louder louder Pray Okay Yeah you are Brave Ah ah ah louder louder all the hater haterIt s time to raise our voice Raise our voice Let s go and make some noise future futur ,Pop
 California Dream broken hmm hmm ocean romantic Come on California girls on the beachOn the West CoastBaby let s go let s goGimme that Hollywood heatMy California dream Post Chorus Ooh ooh ooh ooh ooh my California dreamOoh ooh ooh ooh ooh that s where I wanna beOoh ooh ooh ooh ooh my California dreamOn the West Coast baby let s go let s go,Pop
 Good Night My Princess anybody home Ooh I know there s no one Then you play my favorite song again I don t wanna cryEvery night I try It breaks my heart in two Good night my princess in my dream my favorite song again I don t wanna cryEvery night I try It breaks my heart in two Good night my princess,Pop
 Love Me Out Loud Cause the silence it always hurts soundIf you love me then scream and shoutDon t wanna lose ya but you re fading outSo if you love me Love me out loudOut loud out loudLove me out loud Love me out loud Out loud out loud Love me out love me out loud love me out loud love me out Hear the roar Gotta scream until my lungs run out soundIf you love me then scream and shoutDon t wanna lose ya but you re fading outSo if you love me,Pop
 Nuh Uh Uh nuh nuh nuh nuh uh I know you still like me Uh huh Affecting your psyche likeUh huh nuh uh uh huh Nuh uh nuh uh uh huh my whole damn style fascinating yeah yeah yeahI m work of art I ll take your heart get it racingMaking you stop making you stare cause you know I m rare Right Wanna wanna wannabe right I m the one I m the real oneWanna wanna wannabe right nuh uhBad bad for the historyGood God I m a masterpiece Right Wanna wanna wannabe right I m the one I m the real one Real one Post Chorus Nuh uh uh uh uh uh wannabe right Nuh uh uh uh uh uh and you know it huhNuh uh uh uh uh uh wannabe right Yeah the real one yeah yeah lie,Pop
 ,Pop
 Killing Me Everything feels so strange Everything now has changed Lost in the maze now I m insane hide and seek Stuck with you blueA little too soon It s killing me killing me It s killing me killing meKilling me uh oh oh oh It s killing me killing me baby When does it end Try to pretend Something just fell apart broken heart Stuck with you spin blueA little too soon,Pop
 Someday One day Someday Someday One day SomedaySomedayOne day Someday,Pop
 Bicycle Uh whoa Whoa Oh yeah oh yeah yeah Ah get up I know it Uh Yah yah yah move it uh Te amo I ll give you more I m up here say yeah yeah yeah faster yeah so hard Yeah Yeah let s go on a ride Yeah get on my bike let s go Get out of my way yah how I like it Do it my way yah And it goes like broom broom broom broom Get out of my way yah face it Do it my way yah And it goes like broom broom broom broom Post Chorus I m getting higher you re tripping lowerAnd when I say it s done it s freaking over Over whoa And I I ride it I ride it you like it when I ride itI ride it I ride it Gimme that My sweat dripping down my back I got ice decorating my neckI ll be the strongest thing don t miss it Cause I m the baddest queen I m sicker than all of themGossipin lowkeys don t bring me no funCome on I ll slay you from tip of my tongueYou wanna know And know what she likes Sit back and watch me ride,Rap
 X yeah You know you messed up boy Interlude You should ve loved me at my worstNow you just watch me on your TV screen yeah You know you messed up boy ,Pop
I feel you All the time Warning warning ah Na na na Stay tonight stay tonightStay by my sideStay tonight stay tonight stay sta a a ay Stay with me woah oh Post Chorus Tonight stay tonightTell me what you wanna doRun away or stay toni ah tonightToni ah tonight toni ah tonightTell me what you wanna doRun away or stay tonight Bridge Ah Stay tonight stay tonightStay by my sideStay tonight stay tonight stay,Pop
 Masquerade You can find me right You can find me right You can find me right masquerade masquerade Stepping clapping slow down down down down slow down masquerade oh you there you there masquerade Post Chorus You can find me right You can find me right You can find me right I like it like it dum dum dum du dum dum dum Too much color Oh yeah yeah Stepping clapping slow down down down down slow down,Pop
You re exactly what you re meant to beOh no there ain t nothing wrong with youI lift you up so that you can seeOh what your ex has done to you I ll always treat you differentSo why are you judging me babe I think the scars are healing thenOh but the feelings back again I m out of luck out of time I ve been out of my mindNow you left but you still can t leave her behindWhen I speak in a voice that you hear isn t mineYou said Give me some time can t you see that I m trying She keeps weighting us downI keep wondering if you wanna stayCan t seem to get off the groundBut I keep trying to fly on faith Post Chorus No matter what you say you got me flying on faith yeahNo matter what you say you got me flying on faith I let you tell me what s wrong with meOh when I don t take it out on youBut when I tell you what s wrong with youOh boy you always got an attitude I ll always treat you differentSo why are you judging me babe I think the scars are healing thenOh but the feelings back again,Pop
 Luce Sicut Stellae Ooh yeah yeahNo yeahShine for shine for me tonight Oh Let it shine for me tonight Ooh ooh ooh ooh ooh all day Ooh ooh ooh ooh ooh La la la la La la la la you knowLa la la la Let s get it right now Hoping dreaming wishing one shot One shot Ooh yeah yeah ,Pop
 Oh whoa yeah yeahOh yeah yeah Uh uh uh Ooh ooh ooh Ooh ooh ooh Post Chorus Oh whoa oh oh oh oh oh oh oh oh Oh whoa oh oh oh oh oh oh oh oh Oh whoa oh oh oh oh yeah yeahOh yeah yeah ,Pop
 Chill Ah ah whoa chill Ah ah whoa chill everyday lonely lonely Friday Baby I wanna dance with youShining my youthStyle sweat dripping off meJust cool Baby paradise chill I won t stop this Chill chill chill Just feel it feel it feel it Feel A queen bee in this place uh uh yeah bomb bomb bomb and say my name ,Pop
 All Night Long If I go blind It s alright All day long All night long  If you go blind It s alright love is blind ,Pop
 ,Pop
 Comes N Goes hurricane You re making it It comes and goes comes and goesOoh it comes and goes ooh hurricane You re making it It comes and goes,Pop
 I remember very first time in loveI remember oh ohI remember oh oh oh oh oh so I m in loveI remember oh ohI remember whoa babyI need your love oh ohI need your love oh oh oh oh oh I want you roller coaster ooh ahhRoller coaster oh whoaI need your love loveBaby your love love  uh huh  babyI need your love oh ohI need your love oh oh oh oh oh,Pop
 Snapping Mmh don t make me love you Yeah Really freaky baby Doesn t matter what you baby hate or love Hate or love drop me off take it off yeah Snapping snapping Snapping snapping Snapping snapping I will let you go Post Chorus I know I knowI don t I don t Care Snapping oohSnappin snappin Ooh I know I knowI don t I don t Mind Snapping oohSnappin snappin Baby I feel you Yeah perfume Shoo go on fade away purple rain ,Pop
HangulDoo Doo Doop Doo Doo Doop You I don t really mind ah ha He s got show So danger Make me sad So for now I ll enjoy the rideTake a swing with me oh yeah watch your back I got a bad boy bad boy bad boy so bad I got a bad boy bad boy bad boy oh he s so so bad ,Pop
 Love U Make me feel so high I really want it deep brown eyes I really want it not afraid not a friend I just wanna love you Oh I don t know it Oh oh on my mind love you Oh oh Post Chorus I just wanna wanna love youYou make me Oh oh I just wanna wanna love youOoh whoa I really want it Oh I really want it ,Pop
 Chica Ay s chica true self always messageYou gotta lead your wayAnd you will be okay colors of blue beautiful it is true ready to move Show me your love Chica chica s you ve got it allChica chica s you re beautifulLet it all out let your feelings outLet the world know what you re all about Say it say it Chica chica s you ve got it allChica chica s you re living it like you wannaOoh,Pop
 Be Yourself ooh ooh yeah yeahWhatever you do yeah yeah on yeah be yourself You ooh no more Are you ready Be yourself be yourself be okay like itGet it right keep it low be yourselfYou ooh ooh you ooh ooh yeahYou ooh ooh you ooh ooh yeah Just be yourself be yourself yeah yeah we go hardLet s get get get it yeah,Pop
  CHUNG HA Pre Chorus CHUNG HA Chorus CHUNG HA my friend Ooh  pH gimme that I m serious uh huh yeah Maybe I just can t hide damn Pre Chorus CHUNG HA ,Pop
 ,Pop
  Interlude Okay Let s do thisNow step right thereAnd move like this That s right Dance to itIt s such a good song for you and me Come on Let s groove with meNow step right there Right there And move like this Yeah Dance to itOoh ,Pop
 Call It Love I I call it loveI I call it love I I call it loveI call it love  ,Pop
 Flourishing Yeah I ve got colours of my own I gotta paint them outYeah I wanna go wildGive the canvas what it needs I wanna make them proudI am liking this style I keep loving and that s how I winI m gon be doing my own thingVibin in a new paradiseI ll keep hustling never give inPushin it to the limitVibin in a new paradise Yeah Patience reliefGo deep down freelyBeautiful things no Refrain I m working hard to spell it outFollow my feelin Break down my walls I ll reach my soulYou give me reasons Refrain Just let it outNow I ll make you see what I m about noI m working hard to spell it outFollow my feelin Break down my walls I ll reach my,Pop
 Instrumental OohOoh oohOoh ooh oohYeah yeah Ooh ooh oohOoh ooh Now close your eyes Instrumental ,Pop
 Cherry Kisses Mm mwah cherry kisses when I m without you No I don t need nobody else with you my booRight now now now now now Cause I m in love so in love I m in love with you bae every dayAnd I can t wait till I taste all of yourCherry kisses kissesCherry kisses Cherry kisses kisses Cherry kisses when you re not around meMy lips get lonelyThey get oh so lonely yeah yeah I m addicted that s right You re my one and onlyYou re my one and only one and only ,Pop
 Drive Pre Chorus I never know Chorus You drive me out of my mind Why don t you stop me now Post Chorus Oh one last time with youKiss me one more time will you Pre Chorus I need you oh Chorus You drive me out of my mind Why don t you stop me now ,Pop
 From Now On Let me see your fantasy So now on I wanna show youFrom now on how much I love you I m gonna make you smile So now on I wanna love youFrom now on I wanna tell you oh oh want you to make me smile  I m sure that you re my destiny So now on I wanna show youFrom now on how much I love you I m gonna make you smile So now on I wanna love youFrom now on I wanna tell you want you to make me smile I m gonna make you smile oh ohYeah I do love youOh ooh ooh ooh ooh ooh ,Pop
 Hangul ,Pop
ImagineTemperature upJust forEmotionsOffset,Pop
HangulHmm Do what u doing doing yeah Let my body work Let my body work all nightImma make it worth All your time all your time Ay I know you move Let me show ya Do it just like that Just like that I ll show you what you like oh Don t keep me waitingDo what u doing doing Keep it upMove like u moving moving Never stop oh So do what u doingDo do do itDo what u doing doing Keep it upMove like u moving moving Never stop oh So do what u doing Ay Hmm Do what u doing doingI ll be ah waiting for ya So get it right now I give you one shot baby We can have a real good time Ay I ll show you what you like oh Don t keep me waitingDo what u doing doing Keep it upMove like u moving moving Never stop oh So do what u doing,Pop
HangulDoo Doo Doop Doo Doo Doop You I don t really mind ah ha He s got show So danger Make me sad So for now I ll enjoy the rideTake a swing with me oh yeah watch your back I got a bad boy bad boy bad boy so bad I got a bad boy bad boy bad boy oh he s so so bad I just can let him go oh Get away boy I don t need you nowOh ha stupid at allHe s got show So danger Make me sad ,Pop
Hangul Romanization,Pop
Stand and hold on tight there babeStep to the rhythm and just feel my vibe hmmSo put your hands on meShu wi du daa wah de dumStomp stomp stomp stomp stomp stompWoo babe let s go ,Pop
HangulOh Oh oh I ll make you mine woo Make them all wanna smile like star oh oh oh ohMake a wishMake a wishO o o o What a blissWhat a blissO o o o Make a wishMake a wish Oh for now I wish upon a starOh Oh sweety boy NoOh sweety boy,Pop
Hangul Pre Chorus Chorus In your hand Pre Chorus Chorus In your hand ,Pop
English Translation rough I don t know where I amIf you can catch what s going on every dayHow long will I stay here alone I will spend another day and fall asleepI stand in front of a mirror all dayWith the same expression every dayIn the same voice every dayI sang all dayLa Lala La LarlaEven if you open your eyesRoom still lightedCould it be done far awayEveryone leavesIn the empty space aloneWithout knowing anythingI do this againI do not know where I amIf you can catch what s going on every dayHow long will I stay here alone I will spend another day and fall asleepThe faces I want to seeIs it like me If you stayIs it greedyStill myToward somethingIf you runIf I really wanted toAmong the many low starsIf only one can bearIs it also greedyAs if there were glittering,Pop
English Translation rough I don t know where I amIf you can catch what s going on every dayHow long will I stay here alone I will spend another day and fall asleepI stand in front of a mirror all dayWith the same expression every dayIn the same voice every dayI sang all dayLa Lala La LarlaEven if you open your eyesRoom still lightedCould it be done far awayEveryone leavesIn the empty space aloneWithout knowing anythingI do this againI do not know where I amIf you can catch what s going on every dayHow long will I stay here alone I will spend another day and fall asleepThe faces I want to seeIs it like me If you stayIs it greedyStill myToward somethingIf you runIf I really wanted toAmong the many low starsIf only one can bearIs it also greedyAs if there were glittering,Pop
La LaLaLa LaLaLa Oh Oh Oh OhLa LaLaLa LaLaLa Oh La LaLaLa LaLaLa Oh Oh Oh Oh La LaLaLa LaLaLa Oh La LaLaLa LaLaLa Oh Oh Oh Oh La LaLaLa LaLaLa Yeah Yeah Yeah Woo wah ,Pop
 Intro Satica Stuck in this situationKept it inside for agesLet s just air it outI need air now  Dumbfoundead I was tryna build an empireShe wanted me to stay insideWhile workin nights like the vampireShe said notice me senpaiMy ride or die till I m six feetBut we re gonna need like feetYou can call this somewhat of a sick leaveBaby I might wanna go sight seeYeah Imma need my spaceShe gon need some timeSomeone gets Stephen Hawking on the lineWhat s your horoscope I m a dollar signIt s just how it go I apologizeI might be too blunt and like blunts I might rollI do my own stunts might go stunt on you hoes  Satica Conversations I been having with myselfProblematic wished I could turn to someone elseClose quarters what a borders do they exist Tryna distance before it I ll admitForced to face these issues we can t handleWasn t something we could ve planned forUnprepared for whats ignitedAll my fears yeah they are heightenedAttention is divided Chorus Saticia and Dumbfoundead Can t keep it inside anymore can t keep it inside Getting irrational getting irrational Starting a riot with you starting a riot now Can t keep it inside anymore can t keep it inside  Satica Everything lasts foreverDon t know why we just ignored itWho we even kiddingI was going to the service babe  Dumbfoundead Let s keep it realOff of a pillGod take the wheel nowDrink till it spillLove what we builtI gotta go now,R&B
Hangul Bridge Dumbfoundead I m a hyung since i was youngGet your bread up i ain t playin With you crumbsIma stunt cause i m a hyungI m your hyung s hyung s hyung sHyung s hyung s hyung hold up Hook Dumbfoundead I m on my hyung shit i m on my hyung shitYou ain t a hyungPockets are young you haven t done shitBut fuck all that hyungShit fuck all that hyung shitI m your hyung s hyung s hyung sHyung s hyung s hyung HYUNG SHIT  Dumbfoundead I ve been a hyung they use two handsWhen pourin me rum pour upWalk in the room make it all quietThey holding their tongues hold upShow me respect i ll show it backThats the code of conductI could give a fuck if your bitch ass olderYour bitch call me oppaMi vida locaNo matter the age go out and rageZach de la rochaI m wearing designer oohYou forever ayyYou ll forever be a bumNever be a hyung yeee Bridge Dumbfoundead I m a hyung since i was youngGet your bread up i ain t playin With you crumbsIma stunt cause i m a hyungI m your hyungs hyungs hyungsHyungs hyungs hyung hold up Hook Dumbfoundead I m on my hyung shit i m on my hyung shitYou ain t a hyungPockets are young you haven t done shitBut fuck all that hyung shitFuck all that hyung shitI m your hyungs hyungs hyungsHyungs hyungs hyung HYUNG SHIT ,Rap
