filtered_lyrics,primary_genre
When it s lovelyI believe in anythingWhat does love meanWhen the end is rolling in Ooh Let it go let it stay can we love one another Cold is it safe to be warm in the summer Who knows Who knows I said who knows Ooh teach me to love just to let me goI can t believe that I m not enoughNot enoughAnd so long no one will be here to save youAnd no one will be here to let you knowLet you knowThis is your world This is your world This is your world This is your world Quietly stillIn a lieOh goodnightI don t mind Ooh teach me to love just to let me goI can t believe that I m not enoughNot enoughAnd so long no one will be here to save youAnd no one will be here to let you know Let you know ,R&B
I see nothing out the window windowNothing out the windowWatching all the leaves grow leaves growFeels better in my dreams though dreams though And the sun will shine no moreThe sun will shine Antidote no moreI ve been holdin on too longHoldin on too I know when the wind blows wind blowsFeels better in my dreams though dreams thoughI just wanna sleep foreverPlease just let me leave forever I don t need an antidote antidoteI don t need an antidote antidoteI don t need an antidote forever Forever forever We don t wanna drive slow drive slowSpeed up with our eyes closed eyes closed Eyes closed eyes closedHead down eyes closedIce cold meltdown,Pop
Here I amTorn into a thousand shapes and foldsTorn into a thousand ways I knowFornicate inside your broken homesBefore I throw a smile your way no more I can t tellIf all my answers correlate at allI m telling you a thousand things I know I ve been missing a long timeTo know I had to moveI ve been waiting my whole lifeTo know I wanted youAre you feeling me slowly You can take your fucking timeAnd I promise I won t lieWe ll make it out alive  I m on trialI m not so good at hiding wholesome truthsYou see it on my face when I turn blueSo punish me I m hanging on your nooseSo pull me up so I can breathe with you I knowI ve been missing a long timeTo know I had to moveI ve been waiting my whole lifeTo know I wanted youAre you feeling me slowly You can take your fucking timeAnd I promise I won t lieWe ll make it out alive,Pop
OhOhOh Gimme gimme love gimme gimme loveGimme gimme love gimme gimme loveWhen I m gone when I m gone Oh Gimme gimme love gimme gimme loveGimme gimme love gimme gimme love Oh When I m gone when I m gone Swing around front let me insidePlayin my song into my sidesIt hurts I can t lieRemember those times I fought to get out I want to get outThose pictures so clear will fade in my mindYou re leavin me here with ashes and fireThese people don t heal these people don t feelThese people aren t real so make me this dealWon t you Gimme gimme love gimme gimme loveGimme gimme love gimme gimme loveWhen I m gone Ooh when I m gone When I m gone yeah Gimme gimme love gimme gimme love When I m gone yeah Gimme gimme love gimme gimme love When I m gone yeah When I m gone Ooh yeah when I m gone When I m gone When I m gone when I m gone Look into your heart and let me knowDo things turn black and gray as they go When I m far too gone can you show me love Give me love Ooh ooh Ooh ooh Caught in a river of records and dreams Ooh Oh will you keep up with me Ooh Everyone s looking for someone to hold Ooh But I can t let you go Ooh ooh Ooh ooh ,Pop
I can t do this face to faceBut I ll admit that I m afraidLet these moments go to wasteExcuse me for my plastic tasteExcuse me for my plastic tasteExcuse me for my plastic taste Excuse me for my plastic tasteExcuse me for my plastic tasteLet these moments go to wasteGo away,R&B
 Intro XXXTENTACION Ronny J Duh Ayy huh yuh Members only Hey shouts out Rich Chigga Haha gang Ayy Ronny J listen up Ayy ayy ayy  XXXTENTACION Niggas move like hoes I don t get it bitch yuhI will put a fuckin hole in your fitted bitch yuhRun a check Lil Ll ri bitch I m with it bitch yuhBackseat with that heat fuck with it ayy Yuh Bitch I m on parole still hit the dope ayy Yuh I just wanna fuck ayy bitch I am a ho ayy Yuh FEDs on a stroll still keep a pole Ayy yuh Fuck with my niggas catch a dick in your throat Ayy huh Bridge XXXTENTACION Keith Ape Fuck wit it fuck wit it fuck wit it fuck wit itFuck wit it fuck wit it fuck wit it fuck wit it ayyFuck nigga ayy fuck nigga ayy fuck nigga ayy fuck niggaFuck wit it fuck wit it fuck wit it fuck wit it Ayy Fuck wit it fuck wit it fuck wit it fuck wit it ayyFuck nigga yuh ayy Yuh Fuck nigga yuh ayy Yuh Fuck nigga yuh Yuh Ayy yuh Ayy  Keith Ape XXXTENTACION I got opiate in my mothafuckin vein yuh Ayy yuh I got orca blade in my mothafuckin hand yuh Ayy yuh Kill my enemies then they go bleed to death yuh Ayy yuh Wrist from underwater and my Gin on some Satan yuh Ayy yuh killin myself Yuh Let me go underwater and wet up myself Ayy yuh Ayy yuh Ayy yuh Ayy ayy Sprayin water like Killer Whale Ayy ayy Look at my look at my orca fames Ayy ayy It s us flexin like cocaine Ayy whoa ayy Ayy whoa ayy Ayy whoa Ayy whoa Tanking on my neck know I m the man Ayy umm whoa And I m still Underwater water Ayy whoa Ayy yuh whoa Ayy whoa wuss Bitch ooh ayy Fuck it up run it up ayy Bitch ooh ayy Fuck it up run it up ayy Bitch ooh ayy Bitch bitch Yeah chain chain Fuck it up run it up ayy Bitch ooh ayy Fuck it up run it up ayy Bitch ooh ayy Bitch Yeah bitch ayy ,Rap
 Intro Ski Mask the Slump God They wildin out ayy Huh woke up on a cloud of sauceWet that s betterI need my waterI just be sick sick sickI just be sick sick sick Ayy I just be sick sick sickI just be sick like a sneeze Yuh I just be sick like a sneeze Huh huh I just be sick like a sneeze Huh huh ayy I am replenished I just be sick sick sick Water I just be sick sick sick Ayy sick like a pimple Chorus Ski Mask the Slump God I just be sick like a sneeze Huh huh I just be sick like a sneeze Huh huh sick like a what I just be sick like a sneeze Huh sick like I m who I just be sick like a sneeze Ayy sick like I m who I just be sick sick sick Huh huh Diamonds they sick sick sick Huh My jewelry is cool just like a breezeI just be sick like a sneeze huhI just be sick sick sick sick sick sick Achoo Sick sick sick sick sick Ouch ouch I just be sick like a sneeze ooh Walk up in the club ayy Sick sick sick sick sick sick sick Just like a pimple look at it Diamonds they sick huh yuhI just be sick like a sneeze Wa wa wa wa wa ayy Bridge Ski Mask the Slump God Water Yuh ayy ayy ayy ayy ayy Just like a pimple Just like a Just like a nipple Just like a Ayy never gave a fuck uh Ayy back still hurt I don t give a fuck Huh Never will give a fuck Huh Ayy  Ski Mask the Slump God My diamonds they cool like a breeze How they be cool I just be sick like a sneeze how they be cool Oh my god Jesus Reese s in the piecesPeanut butter colored LV huh Ayy I just be fistin all on your missusThis is a vengeance R Kelly fetus This is a vengeance R Kelly And I rap in season cause don t need a reason None To bust open a gun at your knees bitch None what Wow I m like wow zer Wow wow She don t want me gouge her Gouge gouge Pussy cause my dick it large It Just like a McDonalds fries sir Make it My bitch is a witch but when on me don t catch a curseGoyard on me they can t afford but they call it purseI didn t think this shit washed your pocket more than AllureHol up bitch my money is so ,Rap
 Ayy mull mull Water Ayy yuh Ayy ayy Ayy Woods Ayy water Ayy water Yuh ayy what yuh Woods Ayy Ayy water Ayy water Ayy Woods Ayy water Water Water Yuh Woods Yuh ayy Yuh Woods ayy ayy ayy ayy ayy ayy ayy yuh ayy ayy ayy ayy ayy ayy ayy ayy yuh yuh ayy yuh ayy ayy yuh yuh yuh yuh yuh yuh yuh yuh ayy ayy ayy rule any yuh yuh ayy Ayy yuh Ayy ayy Ayy Woods Ayy water Ayy water Yuh ayy what yuh Woods Ayy Ayy water Ayy water Ayy Woods Ayy water Water Water Yuh Woods Yuh ayy ,Rap
 Intro ZillaKami Thraxx Yeah Chorus ZillaKami Break my neck for respectLay to rest burn a rebel in the flesh Okay Am I dead No not yetWipe the walls with your pain Okay Like it s all alright Huh Like it s all alright Okay Like it s all alright Okay Like it s all alright Okay Hook ZillaKami Fee fi fo fum play with souls I m violent Yeah One two three jump empty out the air from lungs Yeah Fee fi fo fum play with souls I m violent Yeah One two three jump empty out the air from lungs Yeah  ZillaKami Pull up on a red light uh Uh huh kickback uhWatchin your face go numb Okay Pull up and he save you don t need no capeYou ll remember the nameThey see me they freeze up Huh They see me they tense up Uh huh They see me they freeze up Huh They see me they tense up Yeah Chorus ZillaKami Break my neck for respectLay to rest burn a rebel in the flesh Okay Am I dead No not yetWipe the walls with your pain Okay Like it s all alright Huh Like it s all alright Okay Like it s all alright Okay Like it s all alright Okay ,Rap
 Intro MaSiWei DZ What the fu Ayy get Higher get Higher get HigherThere s no Skype no Facebook no Twitter no InstagramWe use WeChat yeah eAyo Keith tell me your WeChat number Ayy Ah hah Chorus DZ BB BB Ayy BB Ooh  DZ MaSiWei Whoa oh Okay Yeah uh huh BB Yuh Ayy Ayy Ooh hoo Ayy Ayy  Psy P I ma Uh Uh Uh business Business Yah Yah yah yah yah Yah uh ooh ,Rap
Thraxx Chorus ZillaKami I came to mosh to break my fist across your face Okay I came to rob and steal and violate the place Wassup I bring the vibe in the trench when I arriveJust to die suicideRaiders getting really high really highI put buckshots in my gauge Okay play satan in this game Okay Put flechette inside my round Okay shoot needles in you face Okay He said uh uh uh uh make your face puckerYuh yuh yuh yuh yuh make your face puckerCigarette to the skin let it burn let it burn Okay Cigarette to th skin let it burn let it burn Okay I like to moshpit h ad knock curb bite face stomp What Moshpit head knock curb bite face stomp Yeah  SosMula Daddy was a gangsta I m just like my dad Sleezy Body in the trunk smelling like a diaper bag Boom boom You be walking with a switch bitch like some type of fag Fuck outta here I be walking wit the big dick all type of mags Boom An my cup dirty Work Perc got me itching just like my butt dirty Work I be selling crack yeah a nigga up early Work Blew racks but the Sleezy tuck Mula Shooters like Steph Curry Boom boom Break ya fucking face wit a elbow to ya nose Fuck outta here I m a skate get away put the pedal to the floor Skrrt Try to change but I can t even get it out my soul No no You could really fucking tell I m the devil on the low Sleezy  Keith Ape And I m too paranoid yeh Cause I think I need them toolsToo paranoid yeh Cause I m looking for them toolsToo paranoid yeh Cause I think I need them toolsI said I m all about lootsBut I m still off them pills and boofI pop an Addy and my brain woke up Pogo uh uh All of my jewelry s drippin like some water Stevie Wonder Uh uh Uh uh ,Rap
 Intro Nascar Aloe Keith Ape I have mental issues You do You messed up Ayo what s up Keith Ape Hm hm that s great that s great Vilex Chorus Nascar Aloe Keith Ape Yeah ayy Oh woo Yeah yeah Oh shit here we go again Yeah hey yeah ah Oh shit here we go again Yeah hey yeah ah Oh shit here we go again Yeah hey yeah ah  Nascar Aloe If your hat MAGA shoot yo ass ra raI don t rock Prada it s too hot in hellWhat he talk Blah blahSilver on but I blockCut him off BarakaCopy me haha hahaWhy the fuck are you so damn obnoxious Sorry bruh catch a bump to yo nogginDirty Chucks everywhere that I m walkingAnd all I want is just to sleep in my coffin Chorus Nascar Aloe Keith Ape Jasiah Yeah ayy Oh shit h re we go again Yeah h y yeah ah go again Oh shit here we go again Yeah hey yeah ah hey Oh shit here we go again Yeah hey yeah ah again Go again okay okay  Jasiah You tried to beat me but you weren t able to do it Hey I miss with me til you re toothlessYou said you re crazy but you weren t able to prove it Prove it Said I m a douche bitch pop me in your cooch thenDamn it boy damn it boyParalyze you from the noiseTold that bitch that I don t give a fuckI came up back and No You don t have no choice So Bitch I m center stage Fuck Til I see some groin groin groin Yuh groin groin,Rap
 So that shit gotSmoking too much triple I m too Fucked up DNA Ayy DNA DNA ,Rap
 Intro Jedi P It s diamondsIt s diamondsIt s diamondsYeah it s diamonds yeah ah yeah ah It s diamondsIt s diamonds yeah Diamonds yeah yeah It s diamonds yeah ah ooh yeah ah Diamonds ooh It s diamonds ooh Diamonds ooh yeah It s diamonds ooh yeah Yeah it s diamonds ooh Yeah it s diamonds ooh yuh Yeah it s diamonds ooh yuh Yeah it s diamonds yuh Chorus Jedi P Keith Ape My watch my watch diamonds My chain my chain diamonds My wrist my wrist diamonds My bitch my bitch diamonds My shoes my pants diamonds I do my dance ah diamonds My hat my shoes is diamonds My gang my crew is diamonds Ayo my watch my watch diamonds My chain my chain diamonds yeah My wrist my wrist diamonds yeah My bitch my bitch diamonds yeah My shoes my pants diamonds e yeah I do my dance oh diamonds e yeah My hat my shoes is diamonds e yeah yuh My gang my crew is diamonds e yeah yuh  Keith Ape I throw it throw it hunnit hunnit Count that hunnit hunnids hunnids Hunnit bands hunnit bands blow things blow things And my and my green belt green belt I make it hunnit hunnit I spend it spend it I want it want it And I and I make it make it again again Look at look at all this all this drugs drugs Jewelries jewelries fames fames Started started dashes dashes Nothin nothin to me to me I just I just wanted wanted A lot o a lot o f money money Tryna escape this world umm That s why I keep collectin greens greens You think that shit s funny ooh that shit s funny Fuck bitch I m for real ooh fuck bitch I m for real I on t play when I m doin my fuckin business ooh yeah e Bitch I m diamond diamond ooh Me and my woes postin chillin blowin O s ooh O s Stevie Wonder Stevie Wonder Medusa Medusa ayy ,Rap
 Ape Sounds Wake up F lthyLittle fuckboy Yo yo yo yo yo yo yo yo What What What What What What On my beast mode look like rob in this hoodPills and drinks on meYah I m on my beast mode Yah I m on my beast mode look like rob in this hoodPills and drinks on meYah I m on my beast mode Yah I m on my beast mode look like rob in this hoodPills and drinks on meYah I m on my beast mode Yah I m on my beast mode I m on my beast modePills and drinks on meYah I m on my beast mode sipping on Ice in my in big blunts ayy like Big PunBitch I m moving like Grim Reaper yo yoIPhone trapping like a beeper Brr brr Bitch Yah bitches look like rob in this hoodPills and drinks on meYah I m on my beast mode Yah I m on my beast mode look like rob in this hoodPills and drinks on meYah I m on my beast mode Yah I m on my beast mode look like rob in this hoodPills and drinks on meYah I m on my beast mode Yah I m on my beast mode ,Rap
 Hook Sex on me bands on me benzo on me valiumOpium protected me from the realityTrust issues PTSD unhappy so happy I m like fuck the feelingsPull up with a stick on me but not no shababi Cause I like let my blade hitI like let my knife hit hitLil bitch big bitch likes to suck dickNow you know I m bout to here killin And I make your bitch swallowing my skeet skeetBut she doesn t love me she loves you and my meat meatLame ninja I be really in the field fieldStill strugglin but still shinin you dig dig Woods Real Low lIfeWe can link up tuff Still Dolo with Hook S x on me bands on me benzo on m valiumOpium protected me from the realityTrust issues PTSD unhappy so happy I m like fuck the feelingsPull up with a stick on me but not no shababi Cause I like let my blade hitI like let my knife hit hitLil bitch big bitch likes to suck dickNow you know I m bout to here killinAnd I make your bitch swallowing my skeet skeetBut she doesn t love me she loves you and my meat meatLame ninja I be really in the field fieldStill strugglin but still shinin you dig dig,Rap
Count my ay Underwater Ninja Mortal KombatSub Zero just like a Santa ay Wrist Blade ay ay You smoke too much But Lil shawty She don t worry bout no O D Dead ps Count my ay Underwater Ninja Mortal KombatSub Zero just like a Santa ay Wrist Blade ay ay kaws miloMonogram Feel like a T I P Rubber Band kaws miloMonogram Feel like a T I P Rubber Band Count em all my blue faces All of this substanceThis ain t for the These are for my movement Looking for the juice manIce in my juice manGot me Feeling likeI m the OJ manIm off the xansAnd I go so stupid wristOn fire like Liu KangSmoke em ops like boof packReal ninja spit the flamesHellfire scorpionFinna back from the hellAnd I m Bout toRevenge on your whole clanMake all you ninjas Faces blue that meansYou all deadIt looks like blue bandsCount my ay Underwater Ninja Mortal KombatSub Zero just like a Santa ay Wrist Blade ay ay KAWS MiloMonogram Feel like a T I P Rubber Band kaws miloMonogram Feel like a T I P Rubber Band ,Rap
I wanna play with someone ughhh uh huh uh huh uh huh uh huh FTP And i m goin Goku ,Rap
 Xen jump off jump off cuff chain Billionaire Boys Club Interlude Uh hum yeah Ayy yeah Hol up what Ayy yeah jump off jump off cuff chain Billionaire Boys Club White Bapestas all my fit big white spaceship White spaceship White Air Force on my feet big white two bricks Two bricks Ain t shining hard just like Stanley Kubrick Stanley Kubrick This ain t no Preme Supreme Supreme Hunnid bands on my wall look like blue screenMannequine cosplay Races look like Louis VMotherbitches work less for my fucking me Fucking me Now Supreme Bapesta settle on me Settle on me Thingy sticky s smoke that poppin green Murakami Murakami fast like Burley Rory Burley Rory Keith Ape in a Bathing Ape just like Skateboard P Hol up bitch I m fucked up Fucked up never ninja s C horus jump off jump off cuff chain Billionaire Boys Club,Rap
  G bodies zombies hip hop Bob MarleySurely they ain t gon test me ha hip hop MC rapper entertainer hip hop K Pop haFuck that soul boom bapRap decapitate of the fags thatIn fact can t rap for crap I am what hip hop lacks bars psycho I m shittin on these bitches kg Big Pun ha  Kid Ash page swag Camo Bape hoody Ma third eye world wide vision Chorus G Kid Ash Young motherfucker only riding with the UGPYoung motherfucker only I m swimmin with the killer killer whalesYoung motherfucker only riding with the UGPYoung motherfucker only I m swimmin with the killer killer whales,Rap
 UL UM Molly I m working on dyingAyy yeah hunnid rollin What Bape ayy Windows ayy Vampire gram backwood Bape Molly Lean Ayy yeah Eleven Cup Lean lean lean ayy lean lean Fanta dirty Yo lean lean ayy lean lean Molly Lean Ayy yeah Eleven Cup Lean lean lean ayy lean lean Fanta dirty Yo lean lean ayy lean lean hunnid rollin What Bape ,Rap
 Okay Okay Black mild wooMy money getting big like Samsung woo woo GoroMortal Kombat zero emo hot drip zip zip lip keep bitch ,Rap
 Intro Kid Ash Yeah what  Kid Ash Yeah I m on my grind beat Rhythm rhythm drum it s like Cobain Chorus Kid Ash On my grind on my grind yeah I m on my grindOn my grind on my grind yeah I m on my grind On my grind on my grind yeah I m on my grindOn my grind on my grind yeah I m on my grind  G Um It s like an allergy reaction one way hater We gotta eat to surviveSo I m talkin hustle get byErrthing gon come in due time Take matters in your own hands ,Rap
 I can lead the way to a sacred placeWhere the inspirations come to meI don t contemplateAll I wanna do is run run it down downRun it down run it down downRun it down run it down downRun it down I m a magician now wand in my handSet my intentions only then magic happensI came with power to create the world Eh ala om ah ehFill me up holy breathEh ala om ah eh Whoa oh oh oh oh ohI ma work that magicEh ah eh eh ah eh Whoa oh oh oh ,Pop
 Refrain When moonlight s shining stars alignMessiah Messiah MessiahFire burn burning highI ll show you how I re ariseNow you can try to crucify meJust sing me one last song Ain t no way downOnly higher Post Chorus Heard that you found me hereWanna come around me here You know my name That s only one thing It s the world I ma hold downSilence is my own sound Refrain When moonlight s shining stars alignMessiah Messiah MessiahFire burn burning highI ll show you how I re ariseNow you can try to crucify meJust sing me one last song,Pop
 I ve been wasting all my timeJust tryna get it over withI need my peace of mind Now I know that tengo que controlarmeSelf aware gotta use it for discerningMe mat overthinking in a rational wayPuedo huir de m misma ya lo s Ah Anywhere it takes me I ll get home Trust me I ma get home Post Chorus Fortuna Na na na na na na fortuna Fortuna Na na na na na na na na na na A D H D AM Fortuna Who knows ,Pop
 Lexie Manta  Not a swimming pool it s an oceanDive in that cash like l m chosenThat my karat got you frozen ya He ll be on the surface lur lurkin Overheated up that gon make me nervous Lucifer Now he can start the fishing buy me another roundDiamonds on me like I m fresh outta waterA Mariner reelin reelin me in with that thin line Pre Chorus Fly underwaterI don t need no manner Fly underwaterI don t need no manner Chorus MantaI fly in water lil MantaDevilfish MantaCall on me I don t need no romancerI fly like a MantaI fly in water lil MantaDevilfish MantaCall on me I don t need no romancer  Yeah Glitter on my skin I m a shinerGot a flight to catch tomorrow back to China China But when I bust it open boy you better swim I be ridin on a wave drippin water tonight,Pop
 Ah Spoken Uh huh huh huhUh huh huh huh huh huh huh huh Ah ,Pop
Like Mulan going to war war war warFor my family I do more more more more Like Mulan going to war war war warFor my people I do more more more more Just like Mulan I ain t never swallow my own pride I make my Kung Fu moves get ya mortified with that whip yeah I am born to rideYeah I m born to die Born to fight Everyday Like Mulan going to war war war warFor my family I do more more more more Like Mulan going to war war war warFor my people I do more more more more No guns and bullets still gonna shoot to the fullest I mma prove Like Mulan going to war war war warFor my family I do more more more more Like Mulan going to war war war warFor my people I do more more more more ,Pop
Come in dive inDrown in fall inEmotions ignitedMy ocean is all yours I love it when you make my rain come downBut you know I don t need you here right now You know I want you to stayWith me babe Cause you know we stayLovin in the morningLovin in the eveningLovin in the morningLovin in the eveningWe can do it in the morningWe can do it in the eveningDo whatever you wantDo whenever you want I love it when you make my rain come downBut you know I don t need you here right now You know I want you to stayWith me babe Cause you know we stayLovin in the morningLovin in the eveningLovin in the morningLovin in the eveningWe can do it in the morningWe can do it in the eveningDo whatever you wantDo whenever you want,Pop
 SHADOW Audemars like Mardi GrasThere s no tomorrowThis so bourgeois Walk hit it I love it oohBalenci shades onMy retro loverIt s a city of sin don t you miss me Shadow shadow wait for meShadow shadow waitShadow sh sh sh shadow Shadow shadow wait for meShadow shadow waitShadow sh sh sh shadow Post Chorus ,Pop
 dance dance Turn it up real loud she yelled at meHere she can now she can now dance danceMy eyes on you come get me savedHere she can now she can now dance dance Don t know why I m shyI kill every vibeStay home Friday nightsThey take me out I ll just cryDon t know why I m shyI kill every vibeStay home Friday nightsThey take me out I ll just cry Guess what you need isn t always what you want from me want from meAll that I need is just a little bit of lovin from your side yes you knowAnd it s never too late to fix my heart for youBut I don t need that I don t need thatSay what you mean cause I can take it better nowJust wanna be on my own Post Chorus Dance dance danceShe can now she can now dance danceHereShe can now she can now dance danceShe can now she can now dance dan dance Here she can now she can now dance dance Here she can now she can now dance dance Don t know why I m shyI kill every vibeStay home Friday nightsThey take me out I ll just cryDon t know why I m shyI kill every vibeStay home Friday nightsThey take me out I ll just cry,Pop
 Lexie Sleep Away You re telling me not to think too much You re too different from them babyI hope you know it know it know it I ve been thinking about you latelyI hope you know it know it know it You re too different from them babyI hope you know it know it know it I ve been thinking about you latelyI hope you know it know it know itRed bottom Louboutin and Yves Saint Laurent You know that I ain t ready yetI know that you know where she atEmpty your glass and get outta my sightThen tonight you ll be goneBut I know that we are better than that babeWhy don t you stay with me ,Pop
 RRR Boy tryna hit me up every time I cool my mindNow I ma pick up for the last timeWorked in my good denial don t tell nobodyBoy tryna gimmie love every time I fall in lineIn time I wake up one thing to confessI ain t no player don t tell nobody Is that how we like it Yeah Come ride with me follow or leadNo stop cross that borderAin t no time wastedAin t no time wastedIs that how we like it Ooh Come ride with me no go doloNo stop cross that border hm hm And baby we gon ride it likeGTRRR GTRRR rid itAye we gon ride it lik GTRRR GTRRR ride itAye we gon ride it likeGTRRR GTRRR ride itAye we gon ride it likeGTRRR GTRRR ride it on Aye where you at tho City on my back got me ballin like a free throwOh yeah ahAnd I m always on no on and offOmni love we can taste someChannel me frequency we become oneLe let it get done we can get stunnedCome receive energy infinite sun Aye Is that how we like it Yeah Come ride with me follow or leadNo stop cross that borderAin t no time wastedAin t no time wastedIs that how we like it Ooh Come ride with me no go doloNo stop cross that border hm hm,Pop
