filtered_lyrics,primary_genre
 Intro Dumbfoundead Engine engine engine engine engine off windows upThat s the way I like to puffEngine on windows upThat s that s the way I like to like toEngine off windows upThat s the way I like to puffBass ba ba bass hardLet it bump let it bump I m on that green lantern rollin up them papers see the green glowBlowin smoke down the Cali coast like a steamboatYeahYou know the whole team dopeOn that Charlie Brown cloud follow it where we goI buy that Hulk in bulkCall it CostcoUse my harvest to garnish the metal with cilantroSweeties surround me like I m having a bake saleWonder why I measure brownies on a weight scaleFairfax Venice Beach K Town USCEverywhere the medics beEveryone be goin greenStreets to the hills filled with your celebritiesSmokin like the sI live my life forever green Hook It s on youLiquor bottle Green sojuWhole crew Clownin on the brown shit they sold youBlonde hair breezy she be messin with that whiteOnce you go green you ll be feelin extra rightOne eyed one horned flyin purple pill eatersWhen you comin down you gon need that chiba chibaThe grass is greenCarded up so don t hassle meFirst to hit the hot box usually the last to leaveEngine off windows up that s the way I like to puffBass high let it bumpWoofers barkin out the trunkMornin or the noon night time while I cruiseMe and Marley on the moveColor green is my moodNY to ATLIn Miami blowin L sAll my hustlers trynna sellWith the homies or by myselfAlabama TennesseeDown in Houston where Devin beOh it feels so heavenlyI live my life forever green,Rap
Girl I need to drop youBecause on the real you re too high schoolYelling on my voicemailWhy you gotta be so hostileI m looking for a love lifeYou addicted to them club lightsWay you re always in my face thoughMan it s almost like you love fightsBy the way I hate your guy friendsDid you have to invite them Actually your girls tooChickenheads never like themWhy the hell you always broke booBut always got a pair of dope shoesOh you need to borrow money right Girl you re turning into old news Hook x I need a new chick Why we never have sex yoCan I get some head thoughYou know a man has needsBullshitting about strep throatGot me feeling mad stressedAlways bringing up the past tenseNow I understand your last exAnd why he bounced like a bad checkFeeling frustrated looking for an upgradeCurrent situation got me boiling in my blood veinsOut to find a new chickDown to earth cool chickHave a future with her start a tribe like Q TipI could be your Phife Dawg loveMy last chick ain t even know who Phife Dawg wasI was like Oh what How we gon get alongIf you don t know any songs on Midnight MaraudersBut your iPod s looking so straightGoing down your playlist think I found my soul mateIt s been only four dates and you re so much coolerWhy the hell did I wait should ve broken up soonerDamnI never knew a love like thisMy last girl never showed me love like thisShe ain t never go to my shows or bump my shitBut you you love my shit,Rap
 INTRO I ma keep it G realI don t fuck with you cuz you disrespecting meYou disrespecting my hood by telling meTake off my flag I don t see how gangsta I was niggaYou lucky on that day I was acting cool cuzI told you I ain t got time for that my niggaToday I got time cuz SAMPLE STUTTERING KID That that you um you have you you would you could you do you w you want INTRO CONT D My nigga you came up on me off some funk shit niggaI don t make peace with niggasI come up on me with some disrespectful shitWhen I didn t even know you niggas HOOK I don t know you motherfuckersI m off the soju motherfuckersThey call me mellow yellowYeah I m rolling cigarillos  I see your parents are worried you re fucking with yellow boys now Tell em that they should be worried I m thinking of hanging around They call me mellow yellow Y all know meStill the same OG better Venmo meFor that eight ball that you picked up last week dogYou gonna learn like a Leap FrogMy people love me like FIFAI be rolling with a hella hella deep squadAsian bitches with the booty doing knee squatsAlways banging with the colour striped knee socksWhere the fuck you from Grew up in a swap meet fake VersaceSo I could give a fuck about your fit,Rap
 Intro Rich Brian Ayy Chorus Rich Brian Uh always workin hard I just got it in my genes Uh Think so much I think my brain is burnin calories Uh I m mostly quiet but I m always wildin when I drink Uh To you it s fantasies but to me it s just last week Uh I don t never stress none of that shit from yesterdayAt nine I got a date told her that she could pick the placeDon t tell me we re the same little bitch this is night and dayI thought we was in Bali shit feel like holidays  Rich Brian I spent my day with a smile and with my soul intactBut you just spent your day on simpin hopin that she gon call you back yeahStop answerin all the questions when nobody askedYou geekin when you winning and it shows me you ain t used to that yeahMy life is startin to look like a completed bucket list ayyYou know you in some trouble if your girl know I existI been winning and I know that s what you hate to seeI feel like I m six foot tall whenever you stand next to meYeah my schedule s packed I got a pool I haven t swam in itLike yeah I m on a date we watchin Parasite she lovin itLike ayy yeah ayy I like to keep my dates affordableLike ayy yeah ayy that s why I got on Forbes article like ayyYou like to hate but you can t walk a mile inside my shoes ayyI m schoolin all these rappers but I never went to school uhYou say you rollin deep those numbers bout to get reducedI came from Indonesia but inside I never moved Chorus Rich Brian Uh always workin hard I just got it in my genes Uh Think so much I think my brain is burnin calories Uh I m mostly quiet but I m always wildin when I drink Uh To you it s fantasies but to me it s just last week Uh I don t never stress none of that shit from yesterdayAt nine I got a date told her that she could pick the placeDon t tell me we re the same little bitch this is night and dayI thought we was in Bali shit feel like holidays,Rap
It s a check Iced out gold chain Chain Frostbite numb the pain Numb I can t stand round Yeah yeah yeah I can t be the same Never Why they wanna do me dirty Why Why these niggas wanna murk me Why Make me wanna hold the thirtyI ve been drinkin I ve been swerving Skrrt Yeah just wanna be a baller yeah a real shot caller Baller I just wanna go out and fuck somebody daughter Daughter Don t mind if I act wild that s how I was brought up Watch out The OG s look so We re just doing what you taught usCubic zirconia man these niggas ain t clear Ayy I Medusa my earrings I put Versace in my ear Sace When I upgrade my levels I m moving to the upper tierI m surrounded by waves that turn my body to a pier Ayy Low in the foreign I m relearning how to steer Skrrt When I open my mouth you see Bling chandeliersWhen I tap the IP like tryin beerFind new walls in that bitch I m the pussy pioneerI need to check my self control noI need to dip myself in gold whoa Yeah I need to not drink and drive when I m on the way to LAFrom the Bay riding on the Skrrt skrrt skrrt skrrt skrrt I need to not measure my success in precious jewels Cause it s crazy what a nigga like me go through for Iced out gold chainFrostbite numb the painI can t stand round Yeah yeah yeah I can t be the sameWhy they wanna do me dirty Why these niggas wanna murk me Make me wanna hold the thirtyI ve been drinkin I ve been swerving Skrrt ,Rap
Yeah Yeah My ones white but I m Black Iverson uhYeah uh Yeah Yeah K Fisha My ones white but I m Black Iverson Allen When I started ballin I was sliding shit Ballin I was in the club fore I was twenty one Yeah yeah Now I m with a savage and she twenty one Yeah that s right I used to wrap two hundreds around twenty ones Damn Now I m in Atlanta shout out Man Started in the back now I m in the frontIn a durag and a beater like I m Iverson Iverson yeah You niggas play all dayI made a lane y all stole the sauc and I watched all y all take Damn I hope it tast amazing considered that y all grace Amen Apologize ahead of time fore metal fly in y all face Fah fah fah We turn this shit into Lebanon cause the gang not far away The gang And we know where y all stay Yeah So let s keep it player why fight And when we can do credit fraud all dayShe wanna crash at my crib tonightBut she leave eyelashes and stupid shit my bitch gon findI hit that pussy with a Pikachu beanie onOn top of Murakami pillow eating SinigangA lot of niggas come around me try to be the sameBut I can t practice with no niggas that s not in the game Bitch I m Black IversonWhen I started ballin I was sliding shit Slidin shit I was in the club fore I was twenty one Twenty one Now I m with a savage and she twenty one Savage savage I used to wrap two hundreds around twenty ones What was I doing Now I m in Atlanta shout out I m really out here Started in the back now I m in the front Rosa Parks In a durag and a beater like I m Iverson Yeah yeah They used to try to leave me out the flyer for the show Yeah they do that Now my trailer say it s Guapdad on HBO HBO Max Bottles of champagne get delivered to my home Ros I m in Cologne smelling like weed buying cologneMiami it s not coldNo we not on a boat I m on the river with my bros The river We in Booby Trap with at least fifteen hoes At least I did ten thousand hours then did fifteen more Yes Cause I m always tryna double my stats and team goalsHoes share the box in the middle like bingo Winner With no prize to takeSo we both on the floor but you ain t never played Never You a fan have a seat sit down and watch the game,Rap
James Delgado Finam scam wayFinam finamScam way It s a check I ve been balling harder then the MetsGala outfit that s the metsI make niggas uncomfortable and we ain t even metSide money turn feta I mean bruh and I ain t moving methMiracle I pull out the whip her favourite rapper T I so I pulled out the tipScam shit aside I could never fake numbers bitch going through my phone tryna find Drake number ahhHonestly I ain t never give a fuck treadmill ass niggas getting mad cause they stuckI had bitches and money before I ever had a buzz I m just tryna fuck the game I don t ever want to bustI won t hesitate to park a hoe ain t no love in my heart no moreI ain t scared of the dark no more cause the VVS shine so bright I know when it s not right there s too many red flags For that money Imma make timeBut I m bad at the same timeThat s an red flag bitch you an red flagI ain t talking bout the gang signI m talking bout when it s game timeYou re doing hella bad that s an red flag Turn her on the VPN cause I got a new bitHomie got fired imma need a new inThe ones you can t hear when can I get in go be social somewhere bitch we making no friendsI need to get my ass out the house when you do what I do you make bandz on the couchThe old me could have been so rich fuck I fucked up with my old bitch FUCK I bounced back with the codo bitchNow my old bitch want me to get her toes dippedMy momma was in the game My daddy was in the game my granny got pissed when she found out I was the sameThey carpool when they see that you got a laneThey choose up when they see that you not a lameOnce the sign go bad imma throw the whole shit awayBruh there too many red flags For that money Imma make timeBut I m bad at the same timeThat s an red flag bitch you an red flagI ain t talking bout the gang signI m talking bout when it s game timeYou re doing hella bad that s an red flag,Rap
Yeah I don t trust fake niggas Yeah Or snake niggas Yeah I could bake niggas or get cake with em Cake Lil brother caught a new court case with it Court I just pray the footage ain t have his face in itI m in first class business every time I fly Yeah Got caught slippin once now while I slide Uh With ten hunnid niggas with me right outside Cause that other shit stress me out baby ayy ayy ayyYeahAyy ayy ayy ayy ayy ayy Yeah I just pulled up in some Lamb like I m sheep skinned Sheep I m not dark or light skinned I m me skinned Me I m a hood nigga but I m not a street nigga Street Even still I m too deep in it Deep Got a breathtakin bitch so thickI can t breathe RIP George Floyd fuck all the PD sI done poured so much drink I can t freezeMy trunk full I can t speed so I don t trust fake niggas Yeah Or snake niggas Yeah I could bake niggas or get cake with em Cake Lil brother caught a new court case with it Court I just pray the footage ain t have his face in itI m in first class business every time I fly Yeah Got caught slippin once now while I slide Uh With ten hunnid niggas with me right outside Cause that other shit stress me out baby ayy ayy ayy If I don t got no money I be pissed offFuckin on a pretty ghetto bitch rawI love when the nails done Check Got a fresh set Yes Mop the floor with that pussy like a wet jet Squirt One of the hottest in my city I could stop snowin I m so breathtakin people thought I caught COVIDNo love for a snitch that is not P rats singin on cam like JacqueesI like to wear a lotta silk like your auntiesI just gave one piece to my one pieceAt the house watchin One Piece with the pump pieceI m really not pressed to get you to fuck meYou don t gotta choose me choose Jigga Juice Yeah He got the black and white jumpin like ZoboomafooI was down on my last then I found a bagI know it made em mad too badI feel like Mike Jack nigga who bad Foot on they neck and foot on the gasI done got respect and I got But I always came back like Samurai JackNever could put no fake shit in my blood I can t even fake a nutMy life lit I can t make this shit upThrew some many ones on Von B day had to rake that shit upRake that shit up ,Rap
 Chorus Lil Debbie Guapdad Card crackin money makin Back blowin kung fu grippin Henny sippin receipt rippin Baby it s a fuckin falconHeartbreakin breath takin Pipe slangin handsome niggaHenny sippin receipt rippin Baby it s the fuckin falconCard crackin makin moneyBack blowin kung fu grippin Henny sippin receipt rippingBaby it s the fuckin falconHeartbreakin breath takin Pipe slangin handsome niggaHenny sippin Yeah receipt rippin Baby Ay it s the fuckin falcon  Guapdad Bitch I m the man I m not actin like I am Bitch Get some act right you not off that act you actin for your fans Action Bitch I m active so I m actively in action for them bands Yeah Had a moment made a movement gave some money to my mansRicky had crack in his socks gettin money off the market when he black and he ain t bought stocks Ooh Niggas ain t have no black Superman all a nigga ever had was the man static shockNo disrespect to the man Virgil but my first Off White was dirty fake Forces Yeah Didn t have a box with em like Roddy Yeah the homies was rich but my momma had portions yeahNow niggas got PorschesOf Porch just to come out on topI just gave dick to a bopNow she an addict like she lit up the rockNiggas tryna learn like a leapfrogBut they asleep y all runnin with herd you a goat I m a sheep dogEating Swiss meatballs post it on the V logBaby throw it back like a recall for this young Chorus Lil Debbie Guapdad Card crackin money makin Back blowin kung fu grippin Henny sippin receipt rippin Baby it s a fuckin falconHeartbreakin breath takin Pipe slangin handsome niggaHenny sippin receipt rippin Baby it s the fuckin falcon,Rap
 Since a nigga been brokeSwiping till my band brokeGas station pump typing in the zip codeAt the ATM tryna load the bit thoughIon gangbang but I still crip thoughNever spend my last on a fit fuck you thought Swipe a card and I cop what a rich nigga gotEven when I was broke I had rich nigga thoughtsFinna download a pro that s a rich nigga s loss HookWay before EDDI was a young scam boy getting shit for freePlaying rose in the store K walk for meIt ain t sweet miss me if your talk is cheapX  Walk to the clerk kinda nervousBut I m trustin the workWe talkin bout golf when my hoe stuff a purse bags and some shoes I m returning Burberry shirtsMaking up names I don t know who i mma be againGotta get a fake ID again The card don t swipe you gotta type it all inWe ain t going bowling but we striking off pinsTime and experienceFinna get a credit line and fuck up your ExperianOn the dark web finna swap up my EthereumI m on Whatsapp tryna find a Nigerian Hook,Rap
Yeah yeah yeahI don t needI remember that shit I started the last song with I don t need a ho I need a whole lot of paperI don t need a ho I need a whole vacationI been outside doin fraud all monthI ain t never seen a nigga like me onceI don t need a ho I need a whole lot of paperI don t need a ho I need a whole vacationI been outside doin fraud all monthI ain t never seen a nigga like me once Swipin cards It s a check doin fraud livin hotDennis Rodman niggas dying at the topHuman Made on the bucket and the rugs Human Made Tryna fuck a Clermont twin in her butt Yeah My life a movie how I m runnin with the chicken Chicken run I m gettin coochie if I m buyin you this ticket Yeah Hello Kitty varsity with the big letters Letters Put my Rollie on cause it make my fit better Upgrade it To fuck an Indian again I would love to I would love to To fuck Julie again I would love to Please To fuck that singing bitch again I would love to Of course But it s a whole lot of something what I m up to Bitch I m lit I feel like Missy Elliott how I m dancing in the rain Missy With this big ass coat bro my outfit is crazyTellin hoes I do skin care it ain t capWhen we fornicate I give this bitch a face mask Reddit That s just foliation I need a whole lot of paperI don t need a ho I need a whole vacationI been outside doin fraud all month All month I ain t never seen a nigga like me once Nigga not ever I don t need a ho I need a whole lot of paper I don t need a ho I don t need a ho I need a whole vacation I don t need a ho I been outside doin fraud all month Yeah ayy Nigga I ain t never seen a nigga like me once Uh uh ,Rap
Hahaha that s hardYeah You never answer when I need youI feel like you only hit me when you need toI can t sweat on how you steppin like them see throughsThis so you I m on your ass like EvisuBut even jeans couldn t hold you like I need toSkin tight so right it looks see throughYou can t let your frozen heart mislead youEven cold blooded things still bleed too Yeah You make me wanna start a riotLate night shots drunk drivin So how can I stop callin Hit it from the back that pussy talkin Had a conversation talkin to herI talk back she call once I call back she ain t pick upThis shit is frustratin Frustratin Compliments they all gas you wanted weedI bought gas pulled over to fill upAt the gas station propane she blowin upAnd tellin me I need growin upBut she actin stupid I m runnin out of patienceI m tryna stay friends just to get in that pussy one more time,Rap
Yeah yeah sheeshCheck check ayy ayyCheck check four thousand yeahScamzel My lifestyle supreme I m not talking about Fairfax Yeah I just want the bubble like the bottom of my Air MaxNinety five hoes wanna crash like a airbag Skrt Niggas consider me a pig but don t compare rappin Yeah I ve been misunderstood reallyWhy you stress me out but you feel so good to me Damn I m always drowning in Hennessy I m addicted to fucking Yeah Take your toxic ass back like you ain t did nothingI need check on me Check My ex she tri d to flex on me Flex Th n got mad and said you don t check on me No I made it bad for anybody who next up It s bad Before the sex bitch I want check stubs Cause it s bigger than busting nuts and blowing backs outGave credit to the wrong one and it maxed out What When you go and roll the dice sometimes you crap outBounce back with the stupid glow up just know how I need bands Ayy Money falling in my handsSo many knots bills falling out my pantsI need bandsEvery time I find somethin new they ain t shitSo all I ever think about is licks I needa brick I need bandsAct like you ve been around somethin Check check Act like you ve been around moneyI need bandsAct like you ve been around somethin Ayy Act right you around money yeah Used to sleep on the floor with the carpet and the nailsNow it s money for bail my girls got BBL s Yeah Tryna get into the industry but I was late in itI ain t never had my own lane I created itSo why would I give us a title if I ma play with it I m in love with you but bitch I hate this relationship I hate it You gotta understand what come with fame when you fuck with meMy job already crazy you act crazy when you fadedYou went left on me then broke up and she left on meNow all your problems and bills supposed to be left on meI m doing bad on anybody who test us Test I got your social in my notes and you next up Yeah Cause it s bigger than doing shows that leftFake diamonds big shoes you cannot hot stepWant a eighth of Wok nigga go tweet a whole tabStop taking whole trips start making dope bitch,Rap
Yeah Yeah yeah YeahAyy Young nigga no food no moves I m finna start dealin Yeah Fuck that I got cousins on crack I m finna start stealin Scammin Workin hard hard work didn t bear fruit I need to start peelin Yeah Defense stats goin up what the fuck is soft I need a hard million Mil It all started with the sidekicks you know the swipe flick I was snaggin them fools Bling Upgraded to the iPods cameras tripods I was grabbin em too Yeah On the train irritated cause my mama goin to jail I m mad as a MewTwo comin out the cage that Louis look great let s see what that pattern would do Louis Runnin into Macy s grabbin a fewA few grabs I ll be back with the loot Yeah Taught niggas how to steal for realSo I got bags then got bags with them too Bags Fuckin hoes while my brothers going in their purseThem niggas was actin a fool Yeah Don t inquire with me on what happened with youBitch just bring me some food and a Magnum too I m fiendin Yeah I need Henny to drown my demons Demons And a pussy to crown my penis Yeah Need a lifeline bitch call Regis Call him Sucked dry from all these leeches Leeches And these leases I m freezin Burr Got a stove nigga need heatin Yeah Low top black s need creases Creases I need it bitch I m greedy Yeah ayy Bitch I m greedy Yeah It s a check Ayy First lick me and Skylar walkin down TenthBoth with our pockets hurtin Yeah No common sense and a lot of nerveWaitin on the whites to get off of work Five Tall tan stupid just mindin his ownAt first was thinkin he was not oneThen he walked past with iPad and iPhoneHah nigga we got one Yes I reached for the cord and he turned aroundAnd seen two demons not playin with him Nah He tried to run Skylar gave him a tripAnd his lanky ass had his face in the fence Bitch My mama doin time I help with the kidsSkylar mama blind he help with rent Yeah They movin us out and they movin em inSo we still in the place they developin in,Rap
Yeah turn it up in the headphonesI need to hear that shit wapThere it isYeah I said fuego coming with the flame like a DracoMake a broke nigga catch up no tomatoesLe go build an infrastructure for my payrollNo squares in my circles save that for the Eggo sHey hoe take a trip down to San DiegoYou bust tricks I flip cards for the pesoFabo nigga geeked up in this bitchI m a pretty ass nigga with a prettier dickBitch hello freeband s all from Neiman sLeave the register I m doing the I just got the receipt danceYou a kiddie pool and niggas been off the deep endAnd I m unemployed everyday is the weekendI m a Bay mobster trend setter wave monsterRuth Chris scamming and I ordered eight lobstersBrought a bitch with me and she called it a feastBitch I just really wanted something to eat Interlude Money money money money moneyHa ha nigga was hungryI woke up I got an appetiteI couldn t find no fettuccine no whereMoney money money moneySo I had to get it instantlyPlease truffle butter me ASAP,Rap
 Intro Guapdad Harikiri on the beatYeah yeah Chorus Guapdad She ain t never seen the oceanI took her to the coastI took her to the seaNever rode a jetskiWe wave running when we hit the beachOut in CaliforniaCalifornia Ayy She wanna come to California Yeah Come to California  Guapdad AyyI m from the Northside of the stateCal Bears yeah that s The BayWest Oakland every day West That s where my momma stayHenny th poolsideGoyard bag tool insideDouble R for the ridePhantom doors suicideDressing room picsShe don t want to buy shit No She just want to eat frozen yogurtAnd suck my dick frozen yogurt Pussy so wet it drip to my wristShe want to walk with a Toy Yorkie like a white bitchCalifornia lifestyleLay back say that slap this play thatPac Dre MacAyyFlip the scriptWhen out of towners comingHe don t know where they at Chorus Guapdad Yung Pinch She ain t never seen the oceanI took her to the coastI took her to the sea Ayy Never rode a jetskiWe wave running when we hit the beach Wave running Out in CaliforniaCalifornia Out in California yeah She wanna come to California California Come to California California yeah ,Rap
