filtered_lyrics,primary_genre
 Bicycle Uh whoa Whoa Oh yeah oh yeah yeah Ah get up I know it Uh Yah yah yah move it uh Te amo I ll give you more I m up here say yeah yeah yeah faster yeah so hard Yeah Yeah let s go on a ride Yeah get on my bike let s go Get out of my way yah how I like it Do it my way yah And it goes like broom broom broom broom Get out of my way yah face it Do it my way yah And it goes like broom broom broom broom Post Chorus I m getting higher you re tripping lowerAnd when I say it s done it s freaking over Over whoa And I I ride it I ride it you like it when I ride itI ride it I ride it Gimme that My sweat dripping down my back I got ice decorating my neckI ll be the strongest thing don t miss it Cause I m the baddest queen I m sicker than all of themGossipin lowkeys don t bring me no funCome on I ll slay you from tip of my tongueYou wanna know And know what she likes Sit back and watch me ride,Rap
Hangul Bridge Dumbfoundead I m a hyung since i was youngGet your bread up i ain t playin With you crumbsIma stunt cause i m a hyungI m your hyung s hyung s hyung sHyung s hyung s hyung hold up Hook Dumbfoundead I m on my hyung shit i m on my hyung shitYou ain t a hyungPockets are young you haven t done shitBut fuck all that hyungShit fuck all that hyung shitI m your hyung s hyung s hyung sHyung s hyung s hyung HYUNG SHIT  Dumbfoundead I ve been a hyung they use two handsWhen pourin me rum pour upWalk in the room make it all quietThey holding their tongues hold upShow me respect i ll show it backThats the code of conductI could give a fuck if your bitch ass olderYour bitch call me oppaMi vida locaNo matter the age go out and rageZach de la rochaI m wearing designer oohYou forever ayyYou ll forever be a bumNever be a hyung yeee Bridge Dumbfoundead I m a hyung since i was youngGet your bread up i ain t playin With you crumbsIma stunt cause i m a hyungI m your hyungs hyungs hyungsHyungs hyungs hyung hold up Hook Dumbfoundead I m on my hyung shit i m on my hyung shitYou ain t a hyungPockets are young you haven t done shitBut fuck all that hyung shitFuck all that hyung shitI m your hyungs hyungs hyungsHyungs hyungs hyung HYUNG SHIT ,Rap
  Dumbfoundead Waking up to instrumentals playing Smoke up in the ceiling fanComplicated wordplay but really I m a simple manI like my weather good I like my women hoodI keep it one hundred and get misunderstoodDon t get my words twisted now we ain t all the sameSome got a silver spoon others have a ball and chainSome wish you all the best some wish you all the painLife s a game and I m trying to make the hall of fameThis society asks you to pick a sideEvery minute of your life three hundred and sixty fiveRed or blue big or small yes or no right or wrongThe difference between the two is the feeling of I belongYeah we in the middle of all thisThe temperature s rising like the middle of AugustThey litter the airwaves you pick up the garbageBig dreams coming out this little apartment Hook Dumbfoundead All I know is keep it coolI stay calmThey ask me How you do that What is this fool on A little bit of this a little bit of thatIt s the whole lot of nothing that keeps me on trackAll I know is keep it coolI stay calmThey ask me How you do that What is this fool on A little bit of this a little bit of thatIt s the whole lot of nothing that keeps me on track,Rap
Hangul So no baby I ain t havin no babies baby baby no And if I m cold baby at least I let these bitches know baby Make my way through the club like I m Moses bruhShe stick her hands down my pocket Don t touch them gold diggers Where my AZNs smoking while they pop a squatIn Korea looking for a decent taco spotWhere my pretty mamas pretty mamas Why you with that ya boys on the come upMy whole teams eating you struggling for Pull up pull up stress Clean up on aisle girl I ll wet you up splash So no baby I ain t havin no babies baby baby no And if I m cold baby at least I let these bitches know baby She want a wedding dress but I ain t Had to hit her with the cross over A I Tryna put her in a taxi but its I won t ever see her but I tell her ,Rap
 Intro Thane Maynard He has got inside he has climbed through the fence and has fallen about meters into the enclosure Debate now turning to whether or not the zoo authorities did the right thing in ordering a gorilla to be shot rather than tranquilizedI don t question why they felt it was a life threatening situation Chorus Dumbfoundead They tryna take me out like HarambeI take a tranquilizer on a MondayWhile the real ones we lost getting listed in the backWhile the fronting motherfuckers get the front pageThe world is a zoo you ve seen the newsYou ve seen them shoot at the youth The world is a zoo I ll see you pigs at the barbecueGod bless the red white and blue Harambe  Dumbfoundead Paranoia just to hit the cornerStarted getting cherry cola and a bag of chips what a bitchNeed a neighborhood watch for the gangs and the copsI ain t talkin bout the standards feel the burner on your neckWon t give you an attorney or a gurney to get checkedWe ll be lucky just to get to die an early deathThey might give me to life for murderin my setBroke boys everywhere like the government in debtWelcome to the jungle with more guns than rosesKeep from going under now don t push me overHold my composure four whiskey sodasI need that Irish no luck with clovers Hook Dumbfoundead They tryna take me out like HarambeI take a tranquilizer on a MondayWhile the real ones we lost getting listed in the backWhile the fronting motherfuckers get the front pageThe world is a zoo you ve seen the newsYou ve seen them shoot at the youth The world is a zoo I ll see you pigs at the barbecueGod bless the red white and blue Harambe  Dumbfoundead Who the fuck the plug Where the medicine man stay It s only o clock and already a bad dayNeed two bad bitches delivered to man caveOne man s soul is something you can t takeCall the repo man I m a people manBut the world don t treat you like an equal manI don t care if you CEO or pizza manWe just want a piece of mind and own a piece of landI don t want my future daughter askin Why they do him like that Why d they do that daddy The fuck I ma say Well baby the world gone mad Losin all the heroes like the Marlboro manSmoked all the leaves off the olive branchHow you stop a killer when the killer in the mirror and gorillaLike someone come and get ya lil mans Harambe,Rap
 lift off Rocket Man drop a hundred grandRocket Man got your manRocket Man fly to JapanRocket Man he don t have a landRocket Rocket Man Man Rocket Man Rocket Rocket Man ManRocket Man Rocket Man Rocket ManRocketManRocket Man never out of gasRocket Man blew another bagRocket Man bitch too badRocket Man whip too fastRocket Rocket Man Man Rocket Man Rocket Rocket Man ManRocket Man Rocket Man Rocket ManRocketMan Rocket Man rocks in my pocket manDiamonds they dripping like AquamanMy life sweet like a chocolateI do not fuck with them operativesThink I might start a monopoly oohThink I might buy me an ivy league schoolMom couldn t buy me the popular shoesNow I can get her a proper masseuseI m on a whole nother leagueMoney on level Vegeta Super Saiyan You are not who they believeFaking like you were Madea I m just saying I ma fuck up all the beansTrying to make peace in Korea Got me a bitch like KhaleesiFreaky like Mia KhalifaOh my God Rocket ManSmoking like it s RotterdamNew whip dashboard hologramOverpriced like it s Big Baller BrandRoll the dice this shit might get out of hand,Rap
Genghis Khan roll with a angry mob that s firin shotsThat are Hollywood propWe smoking up pot from the guy with the locks in the medicine shopIf you wanna know about my whereabouts party at the warehouseFilming up a ratchet chick flick ParamountFahrenheit burnin up paper hold shit down like a cruise ship anchorPissed off let the pistol blowDiddy in the club let the Cristal flowSlow motherfuckers like escargotSleepin on me must be narco Leptic yo exes are sending me titty flix to the text like XXXIf I give you D would you give me weed and the keys to your whip she like Yes Yes Yes Woodstock everyday man I can t stopGot drugs in my Chucks and my HUF socksParty with the bitches at the bus stop why not Loud motherfuckers at the IHOPFuck you Fuck you Fuck you Fuck you Not you you re coolHalf baked and I m looking for that Oracle bitchTryna find answers just like youJust like you yeah I m just like youBut I got a whip and a chick plus twoWe re the role models that you look up toFuck high school let s get mushroomsConfucius and cow shit that s awesomeMoney stretched like DhalsimMy gang is full of bosses Hook HeyWhere you fromWoofI m Genghis KhanHoHey where you fromWoofI m Genghis khanHoHey where you fromWoofI m Genghis KhanHoI m Genghis KhanI m Genghis Khan Mustache is a must haveIf you wanna rule like a king gotta look like oneDrink like one smoke like oneBe ready for a little bit of fistfight funKnockout punch with a roundhouse kickShoes off motherfucker bow down bitchShitty flows go where the outhouse isChicka bow wow got your girl down for sexAlpha male I m rollin up L s as big as Fidel s cigarsHo Trip of the scales I m tipping the scalesKorean Abdul Jabar hoDon t piss me offGot a gift from GodCame up poor Les MiserablesMe and yo hood it s different dawgYo Mr Rogers I m City of God K no switchblades AK warpaint faceBetter obey no wheat pasteGotta pick a side like the OJ caseLord of the Flies Where the Wild Things AreStart a big brawl like the Foxhills mallStain on your shirt like BBQ sauceBlood from your jaw being cracked by Khan Khan You know the nameYeah motherfuckers you know the nameCan t spell Ganghis Genghis without the GangWe take prisoners fuck yo chainDon t bang I bang hoes I m bankroll pursuingBut roll up lil Youngin and you better know what you doin ,Rap
 Intro Dumbfoundead You took me as safeThat was your first mistakeWho said I was safe  Dumbfoundead The other night I watched the OscarsAnd the roster of the only yellow men were all statuesWe a quarter of the populationThere s a room of fuckin percenters laughing at youFuck a bamboo ceiling guess I gotta play the villainODB up at the Grammys on the micLike Wu Tang is for the children Bruce Jenner is a womanOJ was acquittedKim K is a heroThe sky is the limit any minute nowThey gonna let an Asian brotha get a lead roleShots fired I mma reload never saw this side of ChinoHe was always quiet keeping to himselfNever messed with anybody elseThat s the Jonathan that we know Hook Dumbfoundead Seems so safe till one day things go crayI swear if things don t changeMy actions can t be blamed STAND UP And now you gotta duck You know you never gave a fuck I came to get my cut fuck you pay me You know I never gave a fuck  Dumbfoundead I ain t never heard of none y all foolsI can do what every one of y all do Pew pew pew pew If I never get a chanceYou might see the homie show up on the o clock newsYou ain t never seen a yellow boy wild n yellow boy shinin Sound the alarm I got newsGo ahead and pro file em I ain t pro violenceShhhhh silence is how yellow boys moveIts been the same ol thang I swear the game don t changeWhat you talking bout there ain t no spaceGuess i gotta go and make more spaceYou know I m cool as a motherfuckerChillin in the cut hella quiet with the loud packSince I m a cool motherfuckerYou think everything is safe till I ask you where the safe at ,Rap
Hey baby Just calling to see what you were doing I just drove by your house and saw that the lights were on and assumed you were home You re not you wouldn t ignore my calls right Cause if you are you know I ll kill you Just playing Call me back babyI love you Is it even real tell me If it don t kill you and leave fingerprintsYeah she waited on my willWent through nine lives I been deadSaw Jesus on chillMade me burn my whole RolodexNow we really tryna buildIf I don t fuck it up before the sun setI don t know where you lit upFirst swipe on TinderDo you first class went from thirst trap to BritaFive footer killer I m living in no villaGot me losing hair man I m turning into KrillinAll of my homies say Let her go She got me feeling like ediblesBoth of us came from the barrioSing and dance on the Maury showShe be a freak and I m dead in the head fuego yeahYou know I never regret til the dust settles You kill me you kill me We laugh then we cry and you kill me you kill me We kiss then we fight yeah you kill meI hate that I love it you love that I hate itDon t kill me you kill me and I kill meYeah I stick around Cause you be holding me down til I start to drownYou kill me you kill me Yeah y y y yeah you kill me you kill me I gave her keys to the whip and the deed to the cribIf I ever tried to leave she ll put the keys to the whipCourt hearings hoe earrings tight jeans with the TimbsFrom the streets snatch the weave off a bitchBut the pussy s strawberries and the sex is barbaricKnow that she ain t all there but she ll be the pallbearerMan that s loyaltyWrote like fifty songs about my chickShe getting royaltiesMain muse and cause of all my stress was a ladykillerMy name rang through the town on my Frank MillerLike body count til I got with herAlways yelling in my face I need a pop filterShe got melodies for daysMy Norma Jean from Normandie AvenueAbnormal with a Norman Bates attitudeIf in the future something happened and I died for youIt d be you up on the evening news cause,Rap
  Dumbfoundead I m tryna fuck before the bomb dropsGet to you before they build that wallParty on to my heart stopsBefore all of that cholesterolThey copping pistols apocalyptoBut I just want you to take that offIf they pull us over they can t hold usWe ll fuck in front of that racist copThe world gone to shitWe just trying to get lit k handcuffs they arrest me Imma go flexTake you back to my death bedTreat every day like my lastI promise you Imma go slowBut my father told me live fastCause we might Hook Dumbfoundead I don t wanna die aloneIf I don t get to see you girl then we mightFuck like five times in a rowBaby have you seen the worldCause we might dieIt s the end of the world as we know it We might die I just wanna get you naked see you throw it We might Fuck all that money that I made We might What s all that hard work without payWe might die  Dumbfoundead The pussy the death of meThe pussy the life of meEbony ivoryNo type of weaponryCould ever be rivaledNuclear missiles to riflesSwear I m a son of a gunWent to the United NationsAmerica we love our gunsImagine a world like John LennonBe my Yoko Ono during armaggedonWhere will I be in my last daysHopefully Imma be all up in itSmoky red skies baby let s rideTo the next life Skrrt Baby won t you light my fireLet s watch the westside burnWe might ,Rap
Mamma had a dream but she gave it up for meAnd my sister raising kids man that ain t a cup of teaNow she ain t have no cheese but took us to Chuck E CheeseSomewhat of a G living life so sucka freeTold her what I want to be she was cooler than the breezeSupportive as a beam cause I knew she had believedIf it were up to me she d be treated like the queenA life of luxury filled with shiny pretty thingsNow I was only three when she brought me to the StatesMy sister only one crossing borders wasn t safeWhat she did was very brave I think about it everydayFrom Argentina to Mexico and finally LAYes she made it really far someone give her an applauseGot herself a job an apartment and a carBut the struggle isn t over so I keep doing my partsStraight spittin out them bars that ll get us to the stars Hook Tell me momma are we there yet Yeah tell me momma are we there yet Tell me momma are we there yet Tell me momma are we there yet Shorty was a ten she was chillin with her friendsI was trying to be smooth but I couldn t pretendSo I walked up with a brew table napkin and a penTold her we should do something call me when you canMan after two dates I got her back in my placeShe made the bed shake and my heart beat raceYeah we were moving fast but either one of us caredSeducin me with that ass ware really wasn t fairIs this just good sex or is it something that s rareFeelings do intersect when you choke and pull hairAre we two single people or have we become a pairAnd to tell you the truth girl I ain t ready for that dareBut I saw it in her eyes she was falling in deepI barely know you and you barely know meThese are common road rules we should take it slowlySo before you use words like love just let me speak Hook Tell me baby are we there yet Tell me baby are we there yet Yeah tell me baby are we there yet Tell me baby are we there yet ,Rap
You ain t gotta go through it all aloneYou ain t gotta go through it all aloneYou ain t gotta go through it all aloneAll alone you ain t gotta go through it all aloneAll alone you ain t gotta go through it all aloneAll alone you ain t gotta go through it all alone I m pullin up Yeah renaissance man I been going straight medievalI flipped a Lamborghini from my daddy s Buick RegalMy balcony had pigeons now I shoo away the seagullsY all asking for a sequel couldn t disappoint the peopleBye to my weekendsI feel like Ryan SeacrestSharin everything with everybody what s the secret John you a legend but I need a Chrissy TeigenDouble timin like I m Twista need a s cond just to breathe inHold upThe plan t got the ronaThis quarantine ain t nothing when you been a fuckin lonerMy girl more beautiful than anything at MoMASo wake me up in I m going comaAll alone you ain t gotta go through it all aloneAll alone you ain t gotta go through it all alone I m pullin up All alone you ain t gotta go through it all aloneAll alone you ain t gotta go through it all alone I m pullin up Yeah the world burning we pourin out the keroseneWe all hurtin nobody giving therapyThe news looking like an SNL parodyMore than ever waking up with VVS clarityAlone time give me six feet to go the whole nineGo ahead and love yourself won t ever need a co signWaterin my plants since the pandemic now they grow vinesFound a better half that gave my flowers even mo shine,Rap
 Hook Hey let s get one thing clearI want a new life a new lifeHey lets get one thing clear There s much more stardust when you re near  Dumbfoundead Just woke up what I miss Smoke one up in the morningFell asleep with the tv onAnd had me dreams of being on ConanYea I m zonin hit that showerWith my new girl for an hour for an hour Fuck the neighborsLast few nights man we were louderGot my bags packed and my passportDidn t unpack from the last tourSold my merchI made me bank and I ain t talkin backboardStack more stack moreShoulda wrote that on that blackboardWhat the fuck is school forIf you end up livin mad poor That GPA don t matter when you re climbin up my ladderThey will stab you with that daggerFor your status do you gather What you did and how you did it no one gives a fuck at allWhere you going how you get it you should focus on that mo ,Rap
YoBe a man John be a manUsed to get them Marlboros for dadIt made me feel grownDidn t know the problems he hadBut he was real goneWhen he had the bottle in handHe was just dead wrongPromised that I would never grow up and be himBut I never grew up at allAnd now I m womanizing and cheatin drinkin heavily in the P MHavin myself a monsters ball just like my paMy girl lookin the same way my mom didSmeared makeup and tears under her eyelidsGenerations of havin a down ass chickBut we always end up fuckin up that shitPointin fingers at all of my male figuresThe only thing gettin bigger is makin bout six figuresAnd everybody just shut up when I put it on my tabAin t it sad when a Visa s the only credit you have HuhBut that s just John and that s how he isThat s the only way people come into my defenseBut that s just wrong but that s how it isAnd it be helpin me get away with a lot of shitAlotta shit a lotta shit I wish somebody really gave me a whole lot of shitBut they on the dick yeah they on my dick now my ego is getting bigger than Moby DickThey see the videos they see the heroThey take a mess and paint a muralEdit out the a hole put in the b rollRender the clips and you got pure goldShoutout to B tho that s mi amigo kept me in check when I was actin like a devoWhen I was Steve O he made me Steve Jobs I m a CEO now look at me maNow look at me ma I m on my grown shitWhen I mean grown I mean takin care of my own shitNow look at me pa this is some grown shitNow what you taught me forget it I flipped the whole scriptNow look at me girl I m on my grown shitWhat I m sayin I mean it my word is goldenEverything I m sayin you re probably thinkin no shitI shoulda known this already but I m ready now,Rap
  Dumbfoundead Playing catch with a molotov cocktail s baby can you not tell Raised in the midst of the riotsWhile the pigs staying cozy off of SawtelleOJ on the hot trailWith the all white broncoYellow baby with the snot noseWas a bad ass kid with a lip should ve gone on a talk show Pronto prontoI was born to be an OGHad like Dickies with creasesFucking bitches on bleachersEsthers Graces and KeishasRiding down Normandie Warren GWas a clear black not a clear white moveBet you never knew that little Dummy might do itImma live forever like the mummy in the ruins cause Hook Dumbfoundead When I dieI m a godPaint me largeOn the wall x Hook Mural mural on the wall On the wall May this legend never fall Never never fall Mural mural on the wallMay this legend never fallMay this legend never fallMural mural on the  Dumbfoundead Paint my face on the sideOf the liquor store when I dieThe one on Catalina up on th streetPaint me I wanna be immortalizedYoung boy from the KYeah my momma had faithShe was praying for my californicationDaddy putting in the work both hands full of dirtFingers looking like them California raisinsMy parents ain t raised no fool but a legendThey studied me at school as a lessonAfter UCs with the Bruce Lees we at G sYou should listen to em for some wisdomNah I ain t on oneI just never owned nothingFeeling like the good sonI ain t ready to go but,Rap
 st  She was from the other side of the train tracksA classic tale of Romeo Juliet played backI was from the city the inner partsShe was from the hills attending fancy dinner parties but stillWe managed to see each other I had a weekly bus passShe has a Mercedes C class and trust it was much fasterI am a rapper she is a classic pianistI sleep in boxers while she has a pair of fancy pajamasWhen we re together both our social status don t even matterWe should just go to Nevada get married and don t ever look backShe was the classiest sassy with a passion for fashion sense smashin on any of those nasty ass hoodratsUncomparable but only if her parents approvedMaybe they got something against asian american dudes just playinEither way I m sayin its just terrible newsCan t give you karats but can serenade you with tunesChorus Sam Ock You and me we are two stars from different galaxiesWill we cross or be aligned I guess that we ll see in time nd  I swig on ounces she sips on champagne she has a huge backyard I do the landscapinI get her single roses she gets me Laker ticketsCall her on my prepaid phone when I can t wait to kick itWe re quite the odd couple but who are you to judge I know it dont make sense you can call it stupid loveBut it s the whole world against usThey can try to stop us but we re going out like gangstas I know that I m hated by her campBut I swear this ll end like the lady and the trampI m just waiting for my chanceThey keep saying that shes way too good for meSometimes I wish sugar momma was sugar freeCause I ain t in it for the doughI ain t diggin for the goldI just wanna show all yall what both of us been knowinI don t want any problems or any of her dollasI just want yall to leave us alone and don t call usChorus Sam Ock You and me we are two stars from different galaxiesWill we cross or be aligned I guess that we ll see in timeYou and me we are two stars from different galaxiesWill we cross or be aligned I guess that we ll see in time,Rap
