filtered_lyrics,primary_genre
Imagine if life was a gameImagine if all of this is fakeImagine if everything endedAnd we go to Heaven and meet all the greatsImagine if there was no DrakeImagine if there was no WayneWould rappers be garbage Would people be rappin Will everyone still sound the same Man nobody knows it all of a suddenI m overthinkin sound like I m trippin Came to the States feel like I m goin LindsayTaste of fluoride in this water I m drinkin I don t know why I don t make friends in this businessSeem like they all wanna win but not with meWent to a party in hopes for some kissesGirl and her friends and they lookin deliciousI came up to em there was four of emThere was one of me I liked all of emThey liked none of meAll this bubbly got me stumblin Talked more with the one girl with the pretty fit Cause I saw through her and the wall she builtShe actin all that her friends were all wackI asked why she bein cold to meAnd she said she don t like guys like meOh you mean smart and funny and has a big dick And doesn t have to fake shit just to fit inMaybe we re not meant to be acquaintin confidence through the roofNot to mention I m so are youWe both still got lips let s put it to useThen we smashed that night she gave me the flu ayy That shit was not worth it I got sick and sad man it gave me the bluesI started thinkin bout life all the shit I been throughAt when I didn t have friends or schoolOr when I thought nachos was Italian foodWhen I thought smokin cigarettes would make me coolAll the nights that I spent in my roomI guess we could always improveI miss my family miss my homeWish I could visit a little moreThe journey s hours flight too longI only get to see em on my phoneTime does flyI went from good wine to seein tears in my mom s eyesI don t blame her thoughShe used to feed me now I live aloneDoin things she don t know aboutBut I m always her angel Always her angel Man I wonder what my mom was thinkin When she realized that her son s a little too famousA little too anxiousWent from havin no friends now he s singin on stagesI m her youngest sonShe just hopin that I know what to do with my paper,Rap
Saw a car crash it remind me of our first dateThen I went back got massages at that one placeAlways brought friends but today I feel like doin this shit aloneCallin my dad when I wanna hear some wisdomCallin my cab alcohol up in my systemSaw a fist fight and that shit don t even make me scared no moreMan I never been the one to be aloneAll my friends are always hittin up my phoneEvery day is spent with everybody never on my ownBut today I m by myself and I don t even feel aloneLike to smoke cigs every time I feel the outsideLike to play chicks but get mad when they get new guysYou don t get me but I don t blame you I don t get myselfPressin on keys got my life so sweet manGoFundMe on your bitch s pinned tweet manBumpin oldies as I try to dick her downShe said give it to me now and I can t help but listenShe go Oh oh oh oh oh oh oh oh oh Slippery sign all over my doorShow some attitude and bitch I won t showExpectation high I feel like a drone I got some new goalsNot checkin my statement til I got millRushin all year like I commit roadkillKillin everybody like I m in a wrong dealDo triple checks on every move I makeWork til I m tired then sip on some latteOnly do shit if we do it my wayEverything gon depend on what I say Ayy hold up wait a secondMan my flow on lethal weaponHit em with the rhymin patternPut these rappers under pressureThis feel like ArmageddonIf she witcha I ma get herCut you off like Jerry HellerShe gon need another fella ayyI don t take drugs I just take napsFind another girl to eat up like I hate snacksDick gon make her choke like reflux gotta relaxMan yo shit is borin and it s makin me go sleep fastAnd I always care bout everybody but myselfThat s the life of a Virgo never gettin madThat s not the Brian that we knowI just weighed my heart it s about kilosI just fucked a lady and she bout years oldRappin on this instrumentals feelin like a heroNever usin triplet flows because I m not a MigoOnly lastin longer cause I m drunk I don t think she knowsOnly thing that matters that my dick is like my ego They wishin I ma failThese days no picnics ain t no fun and gamesStill motherfuckas always got a lot to sayNever got love so they spreadin all this hate oh ohMan they always actin real toughBut I show up for a show and they just wanna leave townPeople sayin that my words are colder than the winterIt s Brian not Brita so I ll never have a filter,Rap
 Intro XXXTENTACION Ronny J Duh Ayy huh yuh Members only Hey shouts out Rich Chigga Haha gang Ayy Ronny J listen up Ayy ayy ayy  XXXTENTACION Niggas move like hoes I don t get it bitch yuhI will put a fuckin hole in your fitted bitch yuhRun a check Lil Ll ri bitch I m with it bitch yuhBackseat with that heat fuck with it ayy Yuh Bitch I m on parole still hit the dope ayy Yuh I just wanna fuck ayy bitch I am a ho ayy Yuh FEDs on a stroll still keep a pole Ayy yuh Fuck with my niggas catch a dick in your throat Ayy huh Bridge XXXTENTACION Keith Ape Fuck wit it fuck wit it fuck wit it fuck wit itFuck wit it fuck wit it fuck wit it fuck wit it ayyFuck nigga ayy fuck nigga ayy fuck nigga ayy fuck niggaFuck wit it fuck wit it fuck wit it fuck wit it Ayy Fuck wit it fuck wit it fuck wit it fuck wit it ayyFuck nigga yuh ayy Yuh Fuck nigga yuh ayy Yuh Fuck nigga yuh Yuh Ayy yuh Ayy  Keith Ape XXXTENTACION I got opiate in my mothafuckin vein yuh Ayy yuh I got orca blade in my mothafuckin hand yuh Ayy yuh Kill my enemies then they go bleed to death yuh Ayy yuh Wrist from underwater and my Gin on some Satan yuh Ayy yuh killin myself Yuh Let me go underwater and wet up myself Ayy yuh Ayy yuh Ayy yuh Ayy ayy Sprayin water like Killer Whale Ayy ayy Look at my look at my orca fames Ayy ayy It s us flexin like cocaine Ayy whoa ayy Ayy whoa ayy Ayy whoa Ayy whoa Tanking on my neck know I m the man Ayy umm whoa And I m still Underwater water Ayy whoa Ayy yuh whoa Ayy whoa wuss Bitch ooh ayy Fuck it up run it up ayy Bitch ooh ayy Fuck it up run it up ayy Bitch ooh ayy Bitch bitch Yeah chain chain Fuck it up run it up ayy Bitch ooh ayy Fuck it up run it up ayy Bitch ooh ayy Bitch Yeah bitch ayy ,Rap
AyyNever worry bout a single hatin motherfuckerLookin like my next supperAll these moves that I m makin got people talkin Like How many papers is this man signin I m back wit the backpack rapMan I m thinkin that this shit finna make them scatGot a bag full of cash if we talkin bout thatRun run it like Forrest Gump can you feel that AyyI m a renaissance manIf you wanna get a feat you not gon get response manI be hotter than some shit your mom cook in a sauce panDon t be jealous don t be rude go back to rollin up gramsPeople think I m sick as shit but I m just eatin on hamWanna beat me in my game then bitch I m settin up campWhen the females hear my name I know they pussy all dampMr Veterinarian I make that kitty go ham Damn Ballin only seventeen my skin is greenWatchin numbers goin up that s just the everyday routineAll my old friends hit me up they wish they had a time machineFeelin like I m Cube I always hit em with no vaseline Post Chorus Always sayin no when you ask em if they got beef with meDMs blowin up I always say No bitch this dick ain t free Watchin on your every move I got that shit on DVDFlexin all the time but I just know that you a bourgeoisie You got cash buy some chainsI buy houses ain t that strange You ain t shit I get lit all you do is counterfeitLittle chick but she thick and she always on my drinkShit I m thirsty give it back and she blondy just like Zac Who the fuck is Zac High School Musical Bitch hold my stacks I m minutes late to FranceGotta get this cash never give no chanceBetter bounce that ass paid her an advanceGot me through this day sippin on BombayI don t trust you gotta take this surveyMan I don t look back never cut no slackBetter get way back fore yo ass get smacked uhMemphis flow but I m from Jakarta hoNever understood my hustle but I guess the more you knowCheckin on your Instagram I see that shit is going slowAlways hating on the progress man yo ass has gotta go,Rap
Yeah happy birthday to meI m nowAnd women can legally have sex with meShout out Based God I be ridin right down Melrose with a thicky named RoseSittin on my lap but she just tryna be my friend thoughBumpin on that XO and I m bout to call my ex hoMommy daddy home I barely see them like a rainbow You can t get rid of me I ain t goin nowhereAnd I m always multiplyin like I always fornicateCake cake up on this belt the day I landed in the StatesDoin one take all day and I m just spittin out the mace Mace She like sippin out that mason jarShe a hippie she gon suck for some granola barsLittle freaky got me curious like I m on MarsSayin I forgot my roots goddamn you went too far Ayy damn you went too farGot these people all around me man that treat me like a starDressed like I don t give a damn but I be ballin like LaVarGotta wait about three years until I could go to the bar Damn make all my own shit I get all the profitsIf you actin lazy then do not expect your props bitchMovin with the tactics got Gildan on my fabricsGo ham on the mic just like I m sitting in the cockpit ayyUsed to hate the camera now your boy s a naturalNow your boy is on the road two months and I ma get the loadTry to put me in a box I m gon always break the lockCall me D Wayne cause she licking on my Johnson like The RockOh my God man his voice so deep I thought he was plusBrian be so clean wanna let him spank on my bumHe just turned but for him I d catch a case damn Hold up ,Rap
Hello Brian this is your grandmotherUm I don t know if you remember me butDo you have time to maybeMeet up and touch base aboutYou know talk about life maybeAnd catch up you know No no I don t know don t be askin me no moreI just close my door put the do not disturb onDon t you get too close you know I m an animalDon t want to stay too long I just get this shit to goSlo mo when I move so I do not lose controlLomo camera every time I fuck your hoeAirbnb s now start to feel like second homeShe on my dick now this is just a second song Actin like a hooligan I swear I think I m fuckin losin friendsSomebody called me up and told me I ma meet the presidentI said okay then I proceed to leave my friendsAnd every citizen and everybody where I m livin aye ayeYes lawd bought some Bitcoin was bout to buy some moreShe a vegan eatin seared loins can t commit to loveI ain t Google I don t give no answers got the firewallThey keep askin me about some things that they already know I say No no I don t know don t be askin me no moreI just close my door put the the do not disturb onDon t you get too close you know I m an animalDon t want to stay too long I just get this shit to goSlo mo when I move so I do not lose controlLomo camera every time I fuck your hoeAirbnb s now start to feel like second homeShe on my dick now this is just a second song Back in my hometown got me feeling extra strongWhere I ma go now nobody gon really knowCame with a new sound just by sitting in my roomSmell hella good now I been puttin on perfumeTakin pictures with the girls I keep my hits up in my vaultMy rhythm still left in the winter think you gotta wear an extra coatI m Tarantino with the shit directin music videosMan I can sense your cluelessness don t even interview me hoeHoe tell your man to go cause he been stickin like some throat coatI don t like your energy I skate away like FrozoneYou been hearin things about me and you want to know knowIf it s true or false and then I hit you with the ,Rap
I m givin my number to any bitch lookin like RondaI m Gunner Stahl I m takin many picsI m thinkin bout havin many kidsEven Osama gon be like Goddamn that s a lot of kids Lot of kids Hit em with a good amount of the hitsI m thinkin will I put em out of the biz Shout to uicideBoy kill em all rest in pissSip on LaCroix on the bus that I missedTalkin bout somethin that I never didI talk to myself and all my seven chicksThey love to go down just like your relevanceI m a rapper but my name isn t ChanceCome to my show people think I m intenseDon t look amused somethin wrong with your lensOne day the money s gon be for the BenzFlow be so dirty it needed a cleanseI m in my zone I went through this shit aloneDidn t have no friends talk to myself we always get alongI m still learnin I m still fuckin up correct me if I m wrongTalkin business more than usual that means I m out with Sean Never yellow in my urinal I m always drinkin on that PellegrinoI been rockin my own merch I m makin way more green than CeeLoI saw people from my school they all turned out to be some weirdosI don t need no education Internet s my favorite teacher Interlude Ayy ayy told em told em Told that bitch that I don t really give a fuck bout youTold that man that he gotta quit it ain t coolMakin up for the confrontation that I ain t doAs a teen all the fight I ve been in was virtualNow I m gettin old and my dick is gettin olderKeep seven bitches on my phone like a folderWhen they were man I was a toddlerDamn homeschool felt like yesterdayI worked at my mom s cafeMet a girl like every dayIt s my only social placeThey thought I was from LANo I m not but now I m hereTryna fill my parents plateThey call me up like every dayPeople say I m good they say I get what I shouldTell me not to worry everything will go real smoothPeople think I m Dory I m forgettin bout my hoodMan should I be sorry for just doin somethin new Man these dudes gotta be more quiet than they thinkThey be hella sure but I always say amenDo the shit for the people that look like meSo the girls can see them and they think of meAnd not that kid that throw that fit Cause he didn t get straight A s all week,Rap
Ummm ayy Now I see that everybody start to fuck with me Cause they feelin like I m finna go down as a OGFlame lowkey on the top of their dictionaries talkin down on meAnd I always say Guess we ll see Guarantee that you re always finna think I m on speedSound a little trippy think I m on LSD when I started doing itHome school kid never knew he was a prodigy ayeGet back on the track with the crack stackPilin in my wallet gettin fat like a shake shackPictures on my Snapchat that s all I got about last nightAll I know is she was goddamn tight aye Went to America shit is feelin biblicalAll my life I only saw it on the digitalSaid I don t give a fuck about a mothafuckin po On the visa so I can t be smokin indica Flyin hours never felt so rightThey say I get better as the days go byI m just tryna be the goat used to see them walk byGettin ready for this life all I see is red and whiteFlyin hours never felt so rightThey say I get better as the days go byI m just tryna be the goat used to see them walk byGettin ready for this life all I see is red and white Landed in Chicago met the customsMean muggin mothafuckers let me tell ya somethingAnd I almost got deported back to the home town Cause I didn t know what road my hotel s onThen I met my manager Sean chillin in the passengerAnd I m feelin tripped out seein him for the first timeWorked oas for a year that s a long run Now I m finally hereWhat now What to do next I don t careEvery single day feel like I m on a missionWorkin with Pharrell on my first damn sessionNever had to write in a room with nobodyFeelin under pressure man this dude made Happy Wrote a couple bars while chuggin on a Red BullThen all of a sudden all my worries turn into vapors ayy,Rap
I done wore a lot of hatsTell my team take all my people to the back I don t need to flex or tell the people where I m atWho I m with or who I m seein later where I wentAll their validation ain t gon matter in a sec Throw back to the fake RolexPut it on and went into the club like Where the hoes at Member sittin down on my computer bumpin KodakThinkin I should probably go delete all of my old tracksSilly me for thinkin I should probably done more of thatI like all my women short and sweet like all my old raps uhGotta wait til I m done ayy Don t need no more trash I got too many where I m from ayy I done put in work and now I m havin all the funI just did a tour I m ready for another oneI can turn your girl to mine in just a secondDon t get fooled by how I smile cause I can get to actin recklessI been livin so good it s been a while that I ve been jealousKillin shit is what I say when they ask bout my occupationGot my U S Visa on the day before I flew in ayy I don t got too many friends I just hang with the sRed and white born and raised took a flight to LAHang with my day to day kiss a chick in the faceThen I put it on her face we still goin through this phaseWe been fightin everyday shit is sad like animeNever wanted it to be a mess but you gotta get up out my wayDriving lesson shoulda told you stay up in your laneWhen I m doin business better stay the fuck away Fuck away Made me blow up like a microwaveI be makin sure that I be fuckin up your dayI don t mind the fansShowin love to everybody be the most important thingI got Andrew with me and he down to take a stabWait for me to walk it is the word he always sayAll these protocols I m slowly turnin to a diva manI ma beat the runner s ass if he ain t got my Chick fil A Chick fil A Never like to brag but I do it in my rapsWhat I m tryna tell you is I done wore a lot of hatsTell my team take all my people to the back Ayy I don t need to flex or tell the people where I m atWho I m with or who I m seein later where I wentAll their validation ain t gon matter in a sec,Rap
I know it s strangeI left you when I promise to stayAnd when you see me on stage just knowI m searching the crowds for youI know it s strangeThe cupid arrow ain t got the rangeWhen you see me with her just knowThat she doesn t love me too Look out at the hills everydayThe sun doesn t rise the same wayShotgun in my would youFill this empty seat And I know it s already dark outside where I m fromI can t cry I can t cry I can t lieI m thinking maybe this life ain t meant for meCan I fly back home to you Cause life ain t worth it if you ain t involv dTrust I ll wait til dawn till dawnBut the sun just setAnd I m in the shad Won t you call my nameLike you did beforeI m sick of waitingOn the day that I escapeEscape from the hills to you Look out at the hills every dayThe sun doesn t rise the same wayShotgun in my would youFill this empty seat Look out at the hills every dayThe sun doesn t rise the same wayShotgun in my would youFill this empty seat,Rap
One night yeah one nightLet me just come over to your place don t overthink about itSome nights I mightRun away to you and see the skies they getting gloomier Baby won t you tell me your moodAre you feeling blue yeah Are you feeling blue Are you feeling blue whoa Are you feeling Yeah fats on your body look alrightPants with the stripes on the sides oh myI m on a ride to the highs alrightBabe why you looking at my eyes all the time Eyes all the timeI come alive in the night all the time oh oh yeah One night yeah one nightLet me just come over to your place don t overthink about itSome nights I mightRun away to you and see the skies they getting gloomierYeah yeah yeahI feel like the man shawty wanna count my bandsI m in love I mma let you know knowI m in love yeah yeah yeah yeah I don t wanna be real mad nowFace cute and you know that her ass outCash out when I hop and I drag outCats wild and they run around fast now fast fast fast fast I just wanna be by your sideYeah pull me closer to your eyesDamn I got phones shawty wanna slideAye sorry my neck not ice I mma put her on iceI mma make her waste time shitI mma wait inside this line shitGet the fuck out of my mentions my baby wear lingerie differentShe sauna and winter I bought her a pendantPull up to my crib she eating that dinnerShe say I m out of this world I m a VenusEverybody know I m a star and she know thatCold ass flow get your flow backToo many rappers being opps and they chose thatI don t wanna phone back prrrr ,Rap
Are you down to ride Are you down to ride Are you down to ride Ha Hook I see yellow sunshine in the morningI m feeling better every time you still snoring Wow I don t know if you re down for meI don t know if you re down with me Okay your shit mediocreI m so fly they feeding those birdsI know why you choosing those wordsMy oh my better put your clothes first Uhhh I go firstMind so dizzy like a spiral curseSnap on beats I got viral burstWaves on the mic Hawaii Five Errrr skrt Stay up all night like a owl OVO shitCool boys think that they really know shitSense so strong I got scoliosisMy love life be some Romeo shitRomeo JulietHomie don t fool me yetI go to clubs with some drinks in my hand to fit inSo do you really think that I m cooli yet I don t know if you downI don t know if you down for meI don t know if you ll frownI don t know if you ll find your peaceI don t know I don t know I don t knowI don t know,Rap
 Intro Warren Hue It s Chasu s fault Oh yeah yeah yeahYeah yeahOh yeah yeah yeahHmm hmm hmm hmm yeahOh yeah yeahOh yeahOh yeah yeah yeah  Warren Hue Baby showed up with blue jeansI just wanna know the true things about you Yeah hold up ay yeah Baby got the new pink ring yeahNew tee fresh as Febreze yeahAnd she might clean up the dishes yeahYou waiting for me now half past my Uber ride hereSitting on my couchDon t need luggage I don t fly hereYou see me like I m miles awayBut baby I be right hereI think I m not me switch my buttons feel like lightyearYou so goofyGirl can you introduce me about you Maybe just tell me two thingsI just wanna see you shoot me I got youWhy can t you be my cupid Half time I m acting stupid yeahKick it in the crib like Bruce LeeHope that you re not too choosy yeah Chorus Warren Hue Erika Call me up at summertimeWe ll sit down in the park where there s no one behind usYou let me choose yeahI ll wait for you yeah  Warren Hue Baby I m Gemini Yeah Baby I m twin yeahBed bunk drinking on Gin TonicPockets wallet where s my wallet Spend shit on you couple dollarsWe can go eat olive garden yeah,Rap
You make me sit around stick around by your sideCarry all this bullshitFuck a full clip like the stick around your side Man Fuck man I m pissed off tryna get my pocket like Rick RossHeavy on the sides and we lift off I m a big dogI m getting miss calls but I miss y all like damn Damn damn Post  Jeans on my body they Japanese denimPeace for my shawty she really be jealousGreen on a thottie cause she really need bags likeCOD how I m really showing off these tags likeGreen light yellow light red light trafficFuck a bad bitch all I need is a full packageWhen I m with the bros I need wood like a cabinLoud on the smoke but the sound from the mattress You make me move so different Ayy hold up hold up You make me move so different Ayy ayy ayy ayy Why don t you feel me Feel me Touch up against my chest oh no Touch up against my chest oh no Touch up against my chest oh no Oh no You make me feel you make me feel awake Awake You make me feel awake You make me feel like I just woke up and it s bright lookBaby why you picking sides LookLet me just stare at your eyes look Ayy look I m looking at your eyeBitches on the Gram they slidePictures on flash can you find me Bitch I m unique on my mommyYeah on my dad heyTell me why you looking hella mad WaitI just made the crowd go chant ayyCan t afford a supercar no valetLike skrt skrt skrt I do a lotNot twenty one but it s my jobI better run I m outta timeI m out divine I put that crown on my nogginNow they knocking on the door for the wet floor sign look,Rap
 Intro Warren Hue It s Chasu s fault Oh yeah yeah yeahYeah yeahOh yeah yeah yeahHmm hmm hmm hmm yeahOh yeah yeahOh yeahOh yeah yeah yeah  Warren Hue Baby showed up with blue jeansI just wanna know the true things about you Yeah hold up ay yeah Baby got the new pink ring yeahNew tee fresh as Febreze yeahAnd she might clean up the dishes yeahYou waiting for me now half past my Uber ride hereSitting on my couchDon t need luggage I don t fly hereYou see me like I m miles awayBut baby I be right hereI think I m not me switch my buttons feel like lightyearYou so goofyGirl can you introduce me about you Maybe just tell me two thingsI just wanna see you shoot me I got youWhy can t you be my cupid Half time I m acting stupid yeahKick it in the crib like Bruce LeeHope that you re not too choosy yeah Chorus Warren Hue Erika Call me up at summertimeWe ll sit down in the park where there s no one behind usYou let me choose yeahI ll wait for you yeah  Warren Hue Baby I m Gemini Yeah Baby I m twin yeahBed bunk drinking on Gin TonicPockets wallet where s my wallet Spend shit on you couple dollarsWe can go eat olive garden yeah,Rap
Yo hold up are you sure this place is really it It s like two thirty four A M in this bitchAnd we re entering SugartownBro like what have you heard about this place You the only reasonWhy I m comin through so lateWhy I m comin through so lateLet s have some dinner at your placeLet s have some breakfast at mineCallin yo ex I don t hate thatBut I just wish this time would stop Stop that I just want you I just want you Need to recollect my feelingsPut em back through my body and youMy baby x Yuh Slide through the boy dm Aye Do you got a boy I don t see em Aye We can just fuck till the P M Yuh yuh She from HustonBaby why you make this shit confusin Back on my bullshitLike I m wearing red on my full fitHit the full thing like a pool stick Yuh You be lookin skinny like a ruler tallHold up lemme get in it like I m scuba divinDon t even start with that shitYou like Stark with that chestHow your heart is an iron Dancin with me you be dancin with meSee you movin slowly I don t gotta repeat yeahWill you like me back sometime Will you like me back sometime yeah,Rap
